aiter/configs/a8w8_blockscale_tuned_gemm.csv
cu_num,M,N,K,libtype,kernelId,splitK,us,kernelName,tflops,bw,errRatio
256,128,1024,4096,ck,8,0,13.7599,a8w8_blockscale_1x128x128_256x16x64x256_16x16_16x16_1x1_16x16x1_16x16x1_1x16x1x16_4_1x1_intrawave_v1,78.03,361.97,0.0
256,128,4096,1280,ck,7,0,7.4194,a8w8_blockscale_1x128x128_256x16x128x256_16x16_16x16_1x2_16x16x1_16x16x1_1x16x1x16_8_1x2_intrawave_v1,180.9,870.06,0.0
256,1002,3072,6144,ck,18,0,45.6685,a8w8_blockscale_1x128x128_256x64x64x256_16x16_32x32_1x1_16x16x1_16x16x1_1x32x1x8_8_1x1_intrawave_v1,828.23,682.9,0.0
256,1002,8192,3072,ck,0,0,46.1443,a8w8_blockscale_1x128x128_256x128x128x128_16x16_32x32_2x2_8x32x1_8x32x1_1x32x1x8_8_1x1_intrawave_v3,1092.93,967.85,0.0
256,1003,3072,6144,ck,18,0,45.2034,a8w8_blockscale_1x128x128_256x64x64x256_16x16_32x32_1x1_16x16x1_16x16x1_1x32x1x8_8_1x1_intrawave_v1,837.59,690.2,0.0
256,1003,8192,3072,ck,0,0,46.767,a8w8_blockscale_1x128x128_256x128x128x128_16x16_32x32_2x2_8x32x1_8x32x1_1x32x1x8_8_1x1_intrawave_v3,1079.45,955.38,0.0
256,1010,3072,6144,ck,18,0,45.9442,a8w8_blockscale_1x128x128_256x64x64x256_16x16_32x32_1x1_16x16x1_16x16x1_1x32x1x8_8_1x1_intrawave_v1,829.84,680.94,0.0
256,1010,8192,3072,ck,0,0,47.3802,a8w8_blockscale_1x128x128_256x128x128x128_16x16_32x32_2x2_8x32x1_8x32x1_1x32x1x8_8_1x1_intrawave_v3,1072.92,945.89,0.0
256,1063,3072,6144,ck,0,0,46.5374,a8w8_blockscale_1x128x128_256x128x128x128_16x16_32x32_2x2_8x32x1_8x32x1_1x32x1x8_8_1x1_intrawave_v3,862.25,686.25,0.0
256,1063,8192,3072,ck,0,0,60.9272,a8w8_blockscale_1x128x128_256x128x128x128_16x16_32x32_2x2_8x32x1_8x32x1_1x32x1x8_8_1x1_intrawave_v3,878.14,752.5,0.0
256,1095,3072,6144,ck,0,0,47.0012,a8w8_blockscale_1x128x128_256x128x128x128_16x16_32x32_2x2_8x32x1_8x32x1_1x32x1x8_8_1x1_intrawave_v3,879.44,687.85,0.0
256,1095,8192,3072,ck,0,0,60.5341,a8w8_blockscale_1x128x128_256x128x128x128_16x16_32x32_2x2_8x32x1_8x32x1_1x32x1x8_8_1x1_intrawave_v3,910.45,767.67,0.0
256,1220,3072,6144,ck,0,0,47.6722,a8w8_blockscale_1x128x128_256x128x128x128_16x16_32x32_2x2_8x32x1_8x32x1_1x32x1x8_8_1x1_intrawave_v3,966.04,710.39,0.0
256,1220,8192,3072,ck,0,0,62.4223,a8w8_blockscale_1x128x128_256x128x128x128_16x16_32x32_2x2_8x32x1_8x32x1_1x32x1x8_8_1x1_intrawave_v3,983.7,783.41,0.0
256,1221,3072,6144,ck,0,0,47.7471,a8w8_blockscale_1x128x128_256x128x128x128_16x16_32x32_2x2_8x32x1_8x32x1_1x32x1x8_8_1x1_intrawave_v3,965.32,709.53,0.0
256,1221,8192,3072,ck,0,0,62.4163,a8w8_blockscale_1x128x128_256x128x128x128_16x16_32x32_2x2_8x32x1_8x32x1_1x32x1x8_8_1x1_intrawave_v3,984.6,783.8,0.0
256,1233,3072,6144,ck,0,0,47.7647,a8w8_blockscale_1x128x128_256x128x128x128_16x16_32x32_2x2_8x32x1_8x32x1_1x32x1x8_8_1x1_intrawave_v3,974.45,712.36,0.0
256,1233,8192,3072,ck,0,0,62.8542,a8w8_blockscale_1x128x128_256x128x128x128_16x16_32x32_2x2_8x32x1_8x32x1_1x32x1x8_8_1x1_intrawave_v3,987.35,782.05,0.0
256,1235,3072,6144,ck,0,0,48.2247,a8w8_blockscale_1x128x128_256x128x128x128_16x16_32x32_2x2_8x32x1_8x32x1_1x32x1x8_8_1x1_intrawave_v3,966.72,706.07,0.0
256,1235,8192,3072,ck,0,0,62.6815,a8w8_blockscale_1x128x128_256x128x128x128_16x16_32x32_2x2_8x32x1_8x32x1_1x32x1x8_8_1x1_intrawave_v3,991.67,784.82,0.0
256,1238,3072,6144,ck,0,0,48.6556,a8w8_blockscale_1x128x128_256x128x128x128_16x16_32x32_2x2_8x32x1_8x32x1_1x32x1x8_8_1x1_intrawave_v3,960.48,700.58,0.0
256,1238,8192,3072,ck,0,0,63.0255,a8w8_blockscale_1x128x128_256x128x128x128_16x16_32x32_2x2_8x32x1_8x32x1_1x32x1x8_8_1x1_intrawave_v3,988.66,781.47,0.0
256,1750,3072,6144,ck,0,0,69.9512,a8w8_blockscale_1x128x128_256x128x128x128_16x16_32x32_2x2_8x32x1_8x32x1_1x32x1x8_8_1x1_intrawave_v3,944.38,577.24,0.0
256,1750,8192,3072,ck,0,0,81.1141,a8w8_blockscale_1x128x128_256x128x128x128_16x16_32x32_2x2_8x32x1_8x32x1_1x32x1x8_8_1x1_intrawave_v3,1085.88,730.01,0.0
256,2003,3072,6144,ck,0,0,75.3452,a8w8_blockscale_1x128x128_256x128x128x128_16x16_32x32_2x2_8x32x1_8x32x1_1x32x1x8_8_1x1_intrawave_v3,1003.52,577.17,0.0
256,2003,8192,3072,ck,0,0,86.5085,a8w8_blockscale_1x128x128_256x128x128x128_16x16_32x32_2x2_8x32x1_8x32x1_1x32x1x8_8_1x1_intrawave_v3,1165.37,741.39,0.0
256,2021,3072,6144,ck,0,0,75.4532,a8w8_blockscale_1x128x128_256x128x128x128_16x16_32x32_2x2_8x32x1_8x32x1_1x32x1x8_8_1x1_intrawave_v3,1011.09,579.28,0.0
256,2021,8192,3072,ck,0,0,87.0009,a8w8_blockscale_1x128x128_256x128x128x128_16x16_32x32_2x2_8x32x1_8x32x1_1x32x1x8_8_1x1_intrawave_v3,1169.19,741.22,0.0
256,2050,3072,6144,ck,0,0,77.0836,a8w8_blockscale_1x128x128_256x128x128x128_16x16_32x32_2x2_8x32x1_8x32x1_1x32x1x8_8_1x1_intrawave_v3,1003.91,571.65,0.0
256,2050,8192,3072,ck,0,0,99.389,a8w8_blockscale_1x128x128_256x128x128x128_16x16_32x32_2x2_8x32x1_8x32x1_1x32x1x8_8_1x1_intrawave_v3,1038.14,654.51,0.0
256,2093,3072,6144,ck,0,0,77.1748,a8w8_blockscale_1x128x128_256x128x128x128_16x16_32x32_2x2_8x32x1_8x32x1_1x32x1x8_8_1x1_intrawave_v3,1023.76,577.82,0.0
256,2093,8192,3072,ck,0,0,97.4166,a8w8_blockscale_1x128x128_256x128x128x128_16x16_32x32_2x2_8x32x1_8x32x1_1x32x1x8_8_1x1_intrawave_v3,1081.38,676.35,0.0
256,2121,3072,6144,ck,0,0,77.196,a8w8_blockscale_1x128x128_256x128x128x128_16x16_32x32_2x2_8x32x1_8x32x1_1x32x1x8_8_1x1_intrawave_v3,1037.17,582.12,0.0
256,2121,8192,3072,ck,0,0,100.7318,a8w8_blockscale_1x128x128_256x128x128x128_16x16_32x32_2x2_8x32x1_8x32x1_1x32x1x8_8_1x1_intrawave_v3,1059.78,659.49,0.0
256,2371,3072,6144,ck,0,0,79.5169,a8w8_blockscale_1x128x128_256x128x128x128_16x16_32x32_2x2_8x32x1_8x32x1_1x32x1x8_8_1x1_intrawave_v3,1125.58,603.76,0.0
256,2371,8192,3072,ck,0,0,102.7463,a8w8_blockscale_1x128x128_256x128x128x128_16x16_32x32_2x2_8x32x1_8x32x1_1x32x1x8_8_1x1_intrawave_v3,1161.47,693.9,0.0
256,2596,3072,6144,ck,0,0,84.3765,a8w8_blockscale_1x128x128_256x128x128x128_16x16_32x32_2x2_8x32x1_8x32x1_1x32x1x8_8_1x1_intrawave_v3,1161.41,601.76,0.0
256,2596,8192,3072,ck,0,0,116.0592,a8w8_blockscale_1x128x128_256x128x128x128_16x16_32x32_2x2_8x32x1_8x32x1_1x32x1x8_8_1x1_intrawave_v3,1125.81,652.03,0.0
256,3011,3072,6144,ck,0,0,110.3423,a8w8_blockscale_1x128x128_256x128x128x128_16x16_32x32_2x2_8x32x1_8x32x1_1x32x1x8_8_1x1_intrawave_v3,1030.08,506.37,0.0
256,3011,8192,3072,ck,0,0,122.0988,a8w8_blockscale_1x128x128_256x128x128x128_16x16_32x32_2x2_8x32x1_8x32x1_1x32x1x8_8_1x1_intrawave_v3,1241.2,685.9,0.0
256,3027,3072,6144,ck,0,0,111.4635,a8w8_blockscale_1x128x128_256x128x128x128_16x16_32x32_2x2_8x32x1_8x32x1_1x32x1x8_8_1x1_intrawave_v3,1025.14,503.04,0.0
256,3027,8192,3072,ck,0,0,121.6544,a8w8_blockscale_1x128x128_256x128x128x128_16x16_32x32_2x2_8x32x1_8x32x1_1x32x1x8_8_1x1_intrawave_v3,1252.35,690.97,0.0
256,3036,3072,6144,ck,0,0,111.21,a8w8_blockscale_1x128x128_256x128x128x128_16x16_32x32_2x2_8x32x1_8x32x1_1x32x1x8_8_1x1_intrawave_v3,1030.53,505.18,0.0
256,3036,8192,3072,ck,0,0,120.9288,a8w8_blockscale_1x128x128_256x128x128x128_16x16_32x32_2x2_8x32x1_8x32x1_1x32x1x8_8_1x1_intrawave_v3,1263.61,696.56,0.0
256,3242,3072,6144,ck,0,0,113.2164,a8w8_blockscale_1x128x128_256x128x128x128_16x16_32x32_2x2_8x32x1_8x32x1_1x32x1x8_8_1x1_intrawave_v3,1080.95,518.58,0.0
256,3242,8192,3072,ck,0,0,136.6325,a8w8_blockscale_1x128x128_256x128x128x128_16x16_32x32_2x2_8x32x1_8x32x1_1x32x1x8_8_1x1_intrawave_v3,1194.26,645.84,0.0
256,3934,3072,6144,ck,14,0,131.0409,a8w8_blockscale_1x128x128_256x64x256x128_16x16_32x32_2x2_8x32x1_8x32x1_1x32x1x8_8_1x1_intrawave_v1,1133.26,512.93,0.0
256,3934,8192,3072,ck,0,0,159.8603,a8w8_blockscale_1x128x128_256x128x128x128_16x16_32x32_2x2_8x32x1_8x32x1_1x32x1x8_8_1x1_intrawave_v3,1238.61,636.22,0.0
256,3939,3072,6144,ck,14,0,132.3789,a8w8_blockscale_1x128x128_256x64x256x128_16x16_32x32_2x2_8x32x1_8x32x1_1x32x1x8_8_1x1_intrawave_v1,1123.23,508.21,0.0
256,3939,8192,3072,ck,0,0,160.1711,a8w8_blockscale_1x128x128_256x128x128x128_16x16_32x32_2x2_8x32x1_8x32x1_1x32x1x8_8_1x1_intrawave_v3,1237.78,635.59,0.0
256,4004,3072,6144,ck,0,0,132.8509,a8w8_blockscale_1x128x128_256x128x128x128_16x16_32x32_2x2_8x32x1_8x32x1_1x32x1x8_8_1x1_intrawave_v3,1137.71,512.42,0.0
256,4004,8192,3072,ck,0,0,159.7858,a8w8_blockscale_1x128x128_256x128x128x128_16x16_32x32_2x2_8x32x1_8x32x1_1x32x1x8_8_1x1_intrawave_v3,1261.24,645.04,0.0
256,4032,3072,6144,ck,0,0,132.0603,a8w8_blockscale_1x128x128_256x128x128x128_16x16_32x32_2x2_8x32x1_8x32x1_1x32x1x8_8_1x1_intrawave_v3,1152.53,518.09,0.0
256,4032,8192,3072,ck,0,0,159.9587,a8w8_blockscale_1x128x128_256x128x128x128_16x16_32x32_2x2_8x32x1_8x32x1_1x32x1x8_8_1x1_intrawave_v3,1268.69,647.74,0.0
256,4064,3072,6144,ck,0,0,131.8797,a8w8_blockscale_1x128x128_256x128x128x128_16x16_32x32_2x2_8x32x1_8x32x1_1x32x1x8_8_1x1_intrawave_v3,1163.26,521.78,0.0
256,4064,8192,3072,ck,0,0,159.6601,a8w8_blockscale_1x128x128_256x128x128x128_16x16_32x32_2x2_8x32x1_8x32x1_1x32x1x8_8_1x1_intrawave_v3,1281.15,652.86,0.0
256,4404,3072,6144,ck,0,0,145.405,a8w8_blockscale_1x128x128_256x128x128x128_16x16_32x32_2x2_8x32x1_8x32x1_1x32x1x8_8_1x1_intrawave_v3,1143.33,501.98,0.0
256,4404,8192,3072,ck,0,0,174.6199,a8w8_blockscale_1x128x128_256x128x128x128_16x16_32x32_2x2_8x32x1_8x32x1_1x32x1x8_8_1x1_intrawave_v3,1269.39,634.81,0.0
256,4465,3072,6144,ck,0,0,145.8962,a8w8_blockscale_1x128x128_256x128x128x128_16x16_32x32_2x2_8x32x1_8x32x1_1x32x1x8_8_1x1_intrawave_v3,1155.26,505.43,0.0
256,4465,8192,3072,ck,0,0,173.2445,a8w8_blockscale_1x128x128_256x128x128x128_16x16_32x32_2x2_8x32x1_8x32x1_1x32x1x8_8_1x1_intrawave_v3,1297.19,646.7,0.0
256,4489,3072,6144,ck,0,0,144.873,a8w8_blockscale_1x128x128_256x128x128x128_16x16_32x32_2x2_8x32x1_8x32x1_1x32x1x8_8_1x1_intrawave_v3,1169.67,511.04,0.0
256,4489,8192,3072,ck,0,0,177.4289,a8w8_blockscale_1x128x128_256x128x128x128_16x16_32x32_2x2_8x32x1_8x32x1_1x32x1x8_8_1x1_intrawave_v3,1273.4,634.08,0.0
256,4534,3072,6144,ck,0,0,146.4134,a8w8_blockscale_1x128x128_256x128x128x128_16x16_32x32_2x2_8x32x1_8x32x1_1x32x1x8_8_1x1_intrawave_v3,1168.97,509.44,0.0
256,4534,8192,3072,ck,0,0,176.9657,a8w8_blockscale_1x128x128_256x128x128x128_16x16_32x32_2x2_8x32x1_8x32x1_1x32x1x8_8_1x1_intrawave_v3,1289.54,640.69,0.0
256,4537,3072,6144,ck,0,0,146.1306,a8w8_blockscale_1x128x128_256x128x128x128_16x16_32x32_2x2_8x32x1_8x32x1_1x32x1x8_8_1x1_intrawave_v3,1172.01,510.67,0.0
256,4537,8192,3072,ck,0,0,177.4281,a8w8_blockscale_1x128x128_256x128x128x128_16x16_32x32_2x2_8x32x1_8x32x1_1x32x1x8_8_1x1_intrawave_v3,1287.03,639.34,0.0
256,5005,3072,6144,ck,0,0,151.7083,a8w8_blockscale_1x128x128_256x128x128x128_16x16_32x32_2x2_8x32x1_8x32x1_1x32x1x8_8_1x1_intrawave_v3,1245.37,529.8,0.0
256,5005,8192,3072,ck,0,0,196.2502,a8w8_blockscale_1x128x128_256x128x128x128_16x16_32x32_2x2_8x32x1_8x32x1_1x32x1x8_8_1x1_intrawave_v3,1283.62,624.42,0.0
256,5020,3072,6144,ck,0,0,151.2007,a8w8_blockscale_1x128x128_256x128x128x128_16x16_32x32_2x2_8x32x1_8x32x1_1x32x1x8_8_1x1_intrawave_v3,1253.29,532.8,0.0
256,5020,8192,3072,ck,0,0,192.7488,a8w8_blockscale_1x128x128_256x128x128x128_16x16_32x32_2x2_8x32x1_8x32x1_1x32x1x8_8_1x1_intrawave_v3,1310.85,637.28,0.0
256,5031,3072,6144,ck,0,0,151.0115,a8w8_blockscale_1x128x128_256x128x128x128_16x16_32x32_2x2_8x32x1_8x32x1_1x32x1x8_8_1x1_intrawave_v3,1257.61,534.37,0.0
256,5031,8192,3072,ck,0,0,193.1091,a8w8_blockscale_1x128x128_256x128x128x128_16x16_32x32_2x2_8x32x1_8x32x1_1x32x1x8_8_1x1_intrawave_v3,1311.27,637.2,0.0
256,5033,3072,6144,ck,0,0,152.5325,a8w8_blockscale_1x128x128_256x128x128x128_16x16_32x32_2x2_8x32x1_8x32x1_1x32x1x8_8_1x1_intrawave_v3,1245.57,529.2,0.0
256,5033,8192,3072,ck,0,0,191.7658,a8w8_blockscale_1x128x128_256x128x128x128_16x16_32x32_2x2_8x32x1_8x32x1_1x32x1x8_8_1x1_intrawave_v3,1320.98,641.87,0.0
256,5103,3072,6144,ck,0,0,151.4399,a8w8_blockscale_1x128x128_256x128x128x128_16x16_32x32_2x2_8x32x1_8x32x1_1x32x1x8_8_1x1_intrawave_v3,1272.0,538.7,0.0
256,5103,8192,3072,ck,0,0,192.8332,a8w8_blockscale_1x128x128_256x128x128x128_16x16_32x32_2x2_8x32x1_8x32x1_1x32x1x8_8_1x1_intrawave_v3,1331.94,645.38,0.0
256,5108,3072,6144,ck,0,0,151.5519,a8w8_blockscale_1x128x128_256x128x128x128_16x16_32x32_2x2_8x32x1_8x32x1_1x32x1x8_8_1x1_intrawave_v3,1272.31,538.7,0.0
256,5108,8192,3072,ck,0,0,193.0635,a8w8_blockscale_1x128x128_256x128x128x128_16x16_32x32_2x2_8x32x1_8x32x1_1x32x1x8_8_1x1_intrawave_v3,1331.66,645.11,0.0
256,5118,3072,6144,ck,0,0,153.472,a8w8_blockscale_1x128x128_256x128x128x128_16x16_32x32_2x2_8x32x1_8x32x1_1x32x1x8_8_1x1_intrawave_v3,1258.85,532.76,0.0
256,5118,8192,3072,ck,0,0,192.4345,a8w8_blockscale_1x128x128_256x128x128x128_16x16_32x32_2x2_8x32x1_8x32x1_1x32x1x8_8_1x1_intrawave_v3,1338.62,648.23,0.0
256,5126,3072,6144,ck,0,0,155.2463,a8w8_blockscale_1x128x128_256x128x128x128_16x16_32x32_2x2_8x32x1_8x32x1_1x32x1x8_8_1x1_intrawave_v3,1246.41,527.31,0.0
256,5126,8192,3072,ck,0,0,203.2322,a8w8_blockscale_1x128x128_256x128x128x128_16x16_32x32_2x2_8x32x1_8x32x1_1x32x1x8_8_1x1_intrawave_v3,1269.48,614.55,0.0
256,5174,3072,6144,ck,0,0,155.1927,a8w8_blockscale_1x128x128_256x128x128x128_16x16_32x32_2x2_8x32x1_8x32x1_1x32x1x8_8_1x1_intrawave_v3,1258.51,531.29,0.0
256,5174,8192,3072,ck,0,0,205.8747,a8w8_blockscale_1x128x128_256x128x128x128_16x16_32x32_2x2_8x32x1_8x32x1_1x32x1x8_8_1x1_intrawave_v3,1264.92,611.2,0.0
256,5182,3072,6144,ck,0,0,152.9775,a8w8_blockscale_1x128x128_256x128x128x128_16x16_32x32_2x2_8x32x1_8x32x1_1x32x1x8_8_1x1_intrawave_v3,1278.71,539.63,0.0
256,5182,8192,3072,ck,0,0,204.8867,a8w8_blockscale_1x128x128_256x128x128x128_16x16_32x32_2x2_8x32x1_8x32x1_1x32x1x8_8_1x1_intrawave_v3,1272.99,614.91,0.0
256,5191,3072,6144,ck,0,0,156.2883,a8w8_blockscale_1x128x128_256x128x128x128_16x16_32x32_2x2_8x32x1_8x32x1_1x32x1x8_8_1x1_intrawave_v3,1253.8,528.9,0.0
256,5191,8192,3072,ck,0,0,205.8343,a8w8_blockscale_1x128x128_256x128x128x128_16x16_32x32_2x2_8x32x1_8x32x1_1x32x1x8_8_1x1_intrawave_v3,1269.33,612.93,0.0
256,5217,3072,6144,ck,0,0,156.4367,a8w8_blockscale_1x128x128_256x128x128x128_16x16_32x32_2x2_8x32x1_8x32x1_1x32x1x8_8_1x1_intrawave_v3,1258.88,530.44,0.0
256,5217,8192,3072,ck,0,0,203.9536,a8w8_blockscale_1x128x128_256x128x128x128_16x16_32x32_2x2_8x32x1_8x32x1_1x32x1x8_8_1x1_intrawave_v3,1287.45,621.06,0.0
256,5219,3072,6144,ck,0,0,155.0967,a8w8_blockscale_1x128x128_256x128x128x128_16x16_32x32_2x2_8x32x1_8x32x1_1x32x1x8_8_1x1_intrawave_v3,1270.24,535.19,0.0
256,5219,8192,3072,ck,0,0,202.9211,a8w8_blockscale_1x128x128_256x128x128x128_16x16_32x32_2x2_8x32x1_8x32x1_1x32x1x8_8_1x1_intrawave_v3,1294.5,624.41,0.0
256,5226,3072,6144,ck,0,0,155.1203,a8w8_blockscale_1x128x128_256x128x128x128_16x16_32x32_2x2_8x32x1_8x32x1_1x32x1x8_8_1x1_intrawave_v3,1271.75,535.66,0.0
256,5226,8192,3072,ck,0,0,207.1264,a8w8_blockscale_1x128x128_256x128x128x128_16x16_32x32_2x2_8x32x1_8x32x1_1x32x1x8_8_1x1_intrawave_v3,1269.92,612.39,0.0
256,5232,3072,6144,ck,0,0,152.835,a8w8_blockscale_1x128x128_256x128x128x128_16x16_32x32_2x2_8x32x1_8x32x1_1x32x1x8_8_1x1_intrawave_v3,1292.25,544.15,0.0
256,5232,8192,3072,ck,0,0,203.068,a8w8_blockscale_1x128x128_256x128x128x128_16x16_32x32_2x2_8x32x1_8x32x1_1x32x1x8_8_1x1_intrawave_v3,1296.78,625.21,0.0
256,5236,3072,6144,ck,0,0,156.6851,a8w8_blockscale_1x128x128_256x128x128x128_16x16_32x32_2x2_8x32x1_8x32x1_1x32x1x8_8_1x1_intrawave_v3,1261.46,531.09,0.0
256,5236,8192,3072,ck,0,0,208.7495,a8w8_blockscale_1x128x128_256x128x128x128_16x16_32x32_2x2_8x32x1_8x32x1_1x32x1x8_8_1x1_intrawave_v3,1262.45,608.56,0.0
256,5240,3072,6144,ck,0,0,157.0931,a8w8_blockscale_1x128x128_256x128x128x128_16x16_32x32_2x2_8x32x1_8x32x1_1x32x1x8_8_1x1_intrawave_v3,1259.15,530.03,0.0
256,5240,8192,3072,ck,0,0,209.3248,a8w8_blockscale_1x128x128_256x128x128x128_16x16_32x32_2x2_8x32x1_8x32x1_1x32x1x8_8_1x1_intrawave_v3,1259.95,607.26,0.0
256,5246,3072,6144,ck,0,0,155.9759,a8w8_blockscale_1x128x128_256x128x128x128_16x16_32x32_2x2_8x32x1_8x32x1_1x32x1x8_8_1x1_intrawave_v3,1269.62,534.3,0.0
256,5246,8192,3072,ck,0,0,208.6565,a8w8_blockscale_1x128x128_256x128x128x128_16x16_32x32_2x2_8x32x1_8x32x1_1x32x1x8_8_1x1_intrawave_v3,1265.43,609.77,0.0
256,5249,3072,6144,ck,0,0,159.9931,a8w8_blockscale_1x128x128_256x128x128x128_16x16_32x32_2x2_8x32x1_8x32x1_1x32x1x8_8_1x1_intrawave_v3,1238.45,521.11,0.0
256,5249,8192,3072,ck,0,0,205.9021,a8w8_blockscale_1x128x128_256x128x128x128_16x16_32x32_2x2_8x32x1_8x32x1_1x32x1x8_8_1x1_intrawave_v3,1283.09,618.21,0.0
256,5332,3072,6144,ck,0,0,155.1734,a8w8_blockscale_1x128x128_256x128x128x128_16x16_32x32_2x2_8x32x1_8x32x1_1x32x1x8_8_1x1_intrawave_v3,1297.11,543.87,0.0
256,5332,8192,3072,ck,0,0,208.4087,a8w8_blockscale_1x128x128_256x128x128x128_16x16_32x32_2x2_8x32x1_8x32x1_1x32x1x8_8_1x1_intrawave_v3,1287.7,618.52,0.0
256,5354,3072,6144,ck,0,0,154.975,a8w8_blockscale_1x128x128_256x128x128x128_16x16_32x32_2x2_8x32x1_8x32x1_1x32x1x8_8_1x1_intrawave_v3,1304.12,546.31,0.0
256,5354,8192,3072,ck,0,0,206.6803,a8w8_blockscale_1x128x128_256x128x128x128_16x16_32x32_2x2_8x32x1_8x32x1_1x32x1x8_8_1x1_intrawave_v3,1303.83,625.76,0.0
256,5366,3072,6144,ck,0,0,157.0545,a8w8_blockscale_1x128x128_256x128x128x128_16x16_32x32_2x2_8x32x1_8x32x1_1x32x1x8_8_1x1_intrawave_v3,1289.74,540.01,0.0
256,5366,8192,3072,ck,0,0,204.7242,a8w8_blockscale_1x128x128_256x128x128x128_16x16_32x32_2x2_8x32x1_8x32x1_1x32x1x8_8_1x1_intrawave_v3,1319.24,632.88,0.0
256,5376,3072,6144,ck,0,0,154.1539,a8w8_blockscale_1x128x128_256x128x128x128_16x16_32x32_2x2_8x32x1_8x32x1_1x32x1x8_8_1x1_intrawave_v3,1316.46,550.97,0.0
256,5376,8192,3072,ck,0,0,203.8276,a8w8_blockscale_1x128x128_256x128x128x128_16x16_32x32_2x2_8x32x1_8x32x1_1x32x1x8_8_1x1_intrawave_v3,1327.51,636.62,0.0
256,5436,3072,6144,ck,14,0,170.802,a8w8_blockscale_1x128x128_256x64x256x128_16x16_32x32_2x2_8x32x1_8x32x1_1x32x1x8_8_1x1_intrawave_v1,1201.4,501.59,0.0
256,5436,8192,3072,ck,0,0,207.8743,a8w8_blockscale_1x128x128_256x128x128x128_16x16_32x32_2x2_8x32x1_8x32x1_1x32x1x8_8_1x1_intrawave_v3,1316.19,629.85,0.0
256,5440,3072,6144,ck,14,0,170.9833,a8w8_blockscale_1x128x128_256x64x256x128_16x16_32x32_2x2_8x32x1_8x32x1_1x32x1x8_8_1x1_intrawave_v1,1201.01,501.34,0.0
256,5440,8192,3072,ck,0,0,207.7875,a8w8_blockscale_1x128x128_256x128x128x128_16x16_32x32_2x2_8x32x1_8x32x1_1x32x1x8_8_1x1_intrawave_v3,1317.71,630.48,0.0
256,5494,3072,6144,ck,0,0,173.9353,a8w8_blockscale_1x128x128_256x128x128x128_16x16_32x32_2x2_8x32x1_8x32x1_1x32x1x8_8_1x1_intrawave_v3,1192.35,496.65,0.0
256,5494,8192,3072,ck,0,0,212.9732,a8w8_blockscale_1x128x128_256x128x128x128_16x16_32x32_2x2_8x32x1_8x32x1_1x32x1x8_8_1x1_intrawave_v3,1298.39,620.06,0.0
256,5504,3072,6144,ck,0,0,172.2169,a8w8_blockscale_1x128x128_256x128x128x128_16x16_32x32_2x2_8x32x1_8x32x1_1x32x1x8_8_1x1_intrawave_v3,1206.44,502.32,0.0
256,5504,8192,3072,ck,0,0,208.3674,a8w8_blockscale_1x128x128_256x128x128x128_16x16_32x32_2x2_8x32x1_8x32x1_1x32x1x8_8_1x1_intrawave_v3,1329.5,634.7,0.0
256,5506,3072,6144,ck,0,0,175.7073,a8w8_blockscale_1x128x128_256x128x128x128_16x16_32x32_2x2_8x32x1_8x32x1_1x32x1x8_8_1x1_intrawave_v3,1182.9,492.48,0.0
256,5506,8192,3072,ck,0,0,210.1644,a8w8_blockscale_1x128x128_256x128x128x128_16x16_32x32_2x2_8x32x1_8x32x1_1x32x1x8_8_1x1_intrawave_v3,1318.62,629.46,0.0
256,5587,3072,6144,ck,0,0,178.849,a8w8_blockscale_1x128x128_256x128x128x128_16x16_32x32_2x2_8x32x1_8x32x1_1x32x1x8_8_1x1_intrawave_v3,1179.22,489.39,0.0
256,5587,8192,3072,ck,0,0,213.5661,a8w8_blockscale_1x128x128_256x128x128x128_16x16_32x32_2x2_8x32x1_8x32x1_1x32x1x8_8_1x1_intrawave_v3,1316.7,626.82,0.0
256,6002,3072,6144,ck,0,0,181.9651,a8w8_blockscale_1x128x128_256x128x128x128_16x16_32x32_2x2_8x32x1_8x32x1_1x32x1x8_8_1x1_intrawave_v3,1245.12,509.04,0.0
256,6002,8192,3072,ck,0,0,225.0618,a8w8_blockscale_1x128x128_256x128x128x128_16x16_32x32_2x2_8x32x1_8x32x1_1x32x1x8_8_1x1_intrawave_v3,1342.26,630.67,0.0
256,6310,3072,6144,ck,0,0,186.1615,a8w8_blockscale_1x128x128_256x128x128x128_16x16_32x32_2x2_8x32x1_8x32x1_1x32x1x8_8_1x1_intrawave_v3,1279.5,517.89,0.0
256,6310,8192,3072,ck,0,0,239.736,a8w8_blockscale_1x128x128_256x128x128x128_16x16_32x32_2x2_8x32x1_8x32x1_1x32x1x8_8_1x1_intrawave_v3,1324.76,617.07,0.0
256,6345,3072,6144,ck,0,0,186.227,a8w8_blockscale_1x128x128_256x128x128x128_16x16_32x32_2x2_8x32x1_8x32x1_1x32x1x8_8_1x1_intrawave_v3,1286.15,520.02,0.0
256,6345,8192,3072,ck,0,0,240.2357,a8w8_blockscale_1x128x128_256x128x128x128_16x16_32x32_2x2_8x32x1_8x32x1_1x32x1x8_8_1x1_intrawave_v3,1329.34,618.62,0.0
256,6804,3072,6144,ck,0,0,207.3929,a8w8_blockscale_1x128x128_256x128x128x128_16x16_32x32_2x2_8x32x1_8x32x1_1x32x1x8_8_1x1_intrawave_v3,1238.43,494.14,0.0
256,6804,8192,3072,ck,0,0,256.7356,a8w8_blockscale_1x128x128_256x128x128x128_16x16_32x32_2x2_8x32x1_8x32x1_1x32x1x8_8_1x1_intrawave_v3,1333.89,613.64,0.0
256,7153,3072,6144,ck,0,0,210.6977,a8w8_blockscale_1x128x128_256x128x128x128_16x16_32x32_2x2_8x32x1_8x32x1_1x32x1x8_8_1x1_intrawave_v3,1281.54,506.75,0.0
256,7153,8192,3072,ck,0,0,264.8065,a8w8_blockscale_1x128x128_256x128x128x128_16x16_32x32_2x2_8x32x1_8x32x1_1x32x1x8_8_1x1_intrawave_v3,1359.57,620.58,0.0
256,7238,3072,6144,ck,0,0,214.1658,a8w8_blockscale_1x128x128_256x128x128x128_16x16_32x32_2x2_8x32x1_8x32x1_1x32x1x8_8_1x1_intrawave_v3,1275.77,503.42,0.0
256,7238,8192,3072,ck,0,0,273.7023,a8w8_blockscale_1x128x128_256x128x128x128_16x16_32x32_2x2_8x32x1_8x32x1_1x32x1x8_8_1x1_intrawave_v3,1331.01,606.46,0.0
256,7240,3072,6144,ck,0,0,216.2002,a8w8_blockscale_1x128x128_256x128x128x128_16x16_32x32_2x2_8x32x1_8x32x1_1x32x1x8_8_1x1_intrawave_v3,1264.11,498.79,0.0
256,7240,8192,3072,ck,0,0,272.1864,a8w8_blockscale_1x128x128_256x128x128x128_16x16_32x32_2x2_8x32x1_8x32x1_1x32x1x8_8_1x1_intrawave_v3,1338.79,609.98,0.0
256,7604,3072,6144,ck,0,0,217.941,a8w8_blockscale_1x128x128_256x128x128x128_16x16_32x32_2x2_8x32x1_8x32x1_1x32x1x8_8_1x1_intrawave_v3,1317.06,515.33,0.0
256,7604,8192,3072,ck,0,0,278.2331,a8w8_blockscale_1x128x128_256x128x128x128_16x16_32x32_2x2_8x32x1_8x32x1_1x32x1x8_8_1x1_intrawave_v3,1375.54,622.17,0.0
256,8003,3072,6144,ck,0,0,226.3914,a8w8_blockscale_1x128x128_256x128x128x128_16x16_32x32_2x2_8x32x1_8x32x1_1x32x1x8_8_1x1_intrawave_v3,1334.43,517.75,0.0
256,8003,8192,3072,ck,0,0,293.3,a8w8_blockscale_1x128x128_256x128x128x128_16x16_32x32_2x2_8x32x1_8x32x1_1x32x1x8_8_1x1_intrawave_v3,1373.35,616.68,0.0
256,8192,512,7168,ck,0,0,64.1614,a8w8_blockscale_1x128x128_256x128x128x128_16x16_32x32_2x2_8x32x1_8x32x1_1x32x1x8_8_1x1_intrawave_v3,937.16,1103.14,0.0
256,8684,3072,6144,ck,0,0,248.8325,a8w8_blockscale_1x128x128_256x128x128x128_16x16_32x32_2x2_8x32x1_8x32x1_1x32x1x8_8_1x1_intrawave_v3,1317.39,504.69,0.0
256,8684,8192,3072,ck,0,0,309.6981,a8w8_blockscale_1x128x128_256x128x128x128_16x16_32x32_2x2_8x32x1_8x32x1_1x32x1x8_8_1x1_intrawave_v3,1411.31,626.81,0.0
256,8747,3072,6144,ck,0,0,249.1593,a8w8_blockscale_1x128x128_256x128x128x128_16x16_32x32_2x2_8x32x1_8x32x1_1x32x1x8_8_1x1_intrawave_v3,1325.21,507.14,0.0
256,8747,8192,3072,ck,0,0,325.0746,a8w8_blockscale_1x128x128_256x128x128x128_16x16_32x32_2x2_8x32x1_8x32x1_1x32x1x8_8_1x1_intrawave_v3,1354.31,600.93,0.0
256,9001,3072,6144,ck,0,0,250.365,a8w8_blockscale_1x128x128_256x128x128x128_16x16_32x32_2x2_8x32x1_8x32x1_1x32x1x8_8_1x1_intrawave_v3,1357.12,517.16,0.0
256,9001,8192,3072,ck,0,0,326.6084,a8w8_blockscale_1x128x128_256x128x128x128_16x16_32x32_2x2_8x32x1_8x32x1_1x32x1x8_8_1x1_intrawave_v3,1387.09,613.24,0.0
256,9018,3072,6144,ck,0,0,253.9458,a8w8_blockscale_1x128x128_256x128x128x128_16x16_32x32_2x2_8x32x1_8x32x1_1x32x1x8_8_1x1_intrawave_v3,1340.51,510.69,0.0
256,9018,8192,3072,ck,0,0,329.1471,a8w8_blockscale_1x128x128_256x128x128x128_16x16_32x32_2x2_8x32x1_8x32x1_1x32x1x8_8_1x1_intrawave_v3,1378.99,609.51,0.0
256,9020,3072,6144,ck,0,0,255.845,a8w8_blockscale_1x128x128_256x128x128x128_16x16_32x32_2x2_8x32x1_8x32x1_1x32x1x8_8_1x1_intrawave_v3,1330.86,506.99,0.0
256,9020,8192,3072,ck,0,0,326.4394,a8w8_blockscale_1x128x128_256x128x128x128_16x16_32x32_2x2_8x32x1_8x32x1_1x32x1x8_8_1x1_intrawave_v3,1390.74,614.69,0.0
256,10015,3072,6144,ck,0,0,282.8291,a8w8_blockscale_1x128x128_256x128x128x128_16x16_32x32_2x2_8x32x1_8x32x1_1x32x1x8_8_1x1_intrawave_v3,1336.69,501.85,0.0
256,10015,8192,3072,ck,0,0,360.9581,a8w8_blockscale_1x128x128_256x128x128x128_16x16_32x32_2x2_8x32x1_8x32x1_1x32x1x8_8_1x1_intrawave_v3,1396.48,609.54,0.0
256,10237,3072,6144,ck,0,0,284.4912,a8w8_blockscale_1x128x128_256x128x128x128_16x16_32x32_2x2_8x32x1_8x32x1_1x32x1x8_8_1x1_intrawave_v3,1358.33,508.51,0.0
256,10237,8192,3072,ck,0,0,368.9375,a8w8_blockscale_1x128x128_256x128x128x128_16x16_32x32_2x2_8x32x1_8x32x1_1x32x1x8_8_1x1_intrawave_v3,1396.56,608.06,0.0
256,10409,3072,6144,ck,0,0,287.2268,a8w8_blockscale_1x128x128_256x128x128x128_16x16_32x32_2x2_8x32x1_8x32x1_1x32x1x8_8_1x1_intrawave_v3,1368.0,511.03,0.0
256,10409,8192,3072,ck,0,0,376.3073,a8w8_blockscale_1x128x128_256x128x128x128_16x16_32x32_2x2_8x32x1_8x32x1_1x32x1x8_8_1x1_intrawave_v3,1392.22,605.05,0.0
256,10411,3072,6144,ck,0,0,286.4549,a8w8_blockscale_1x128x128_256x128x128x128_16x16_32x32_2x2_8x32x1_8x32x1_1x32x1x8_8_1x1_intrawave_v3,1371.95,512.49,0.0
256,10411,8192,3072,ck,0,0,378.1331,a8w8_blockscale_1x128x128_256x128x128x128_16x16_32x32_2x2_8x32x1_8x32x1_1x32x1x8_8_1x1_intrawave_v3,1385.76,602.23,0.0
256,10443,3072,6144,ck,0,0,287.6464,a8w8_blockscale_1x128x128_256x128x128x128_16x16_32x32_2x2_8x32x1_8x32x1_1x32x1x8_8_1x1_intrawave_v3,1370.47,511.73,0.0
256,10443,8192,3072,ck,0,0,377.9563,a8w8_blockscale_1x128x128_256x128x128x128_16x16_32x32_2x2_8x32x1_8x32x1_1x32x1x8_8_1x1_intrawave_v3,1390.67,604.16,0.0
256,10802,3072,6144,ck,0,0,297.7473,a8w8_blockscale_1x128x128_256x128x128x128_16x16_32x32_2x2_8x32x1_8x32x1_1x32x1x8_8_1x1_intrawave_v3,1369.49,509.19,0.0
256,10802,8192,3072,ck,0,0,391.5693,a8w8_blockscale_1x128x128_256x128x128x128_16x16_32x32_2x2_8x32x1_8x32x1_1x32x1x8_8_1x1_intrawave_v3,1388.47,600.99,0.0
256,10807,3072,6144,ck,0,0,297.8509,a8w8_blockscale_1x128x128_256x128x128x128_16x16_32x32_2x2_8x32x1_8x32x1_1x32x1x8_8_1x1_intrawave_v3,1369.65,509.22,0.0
256,10807,8192,3072,ck,0,0,389.8938,a8w8_blockscale_1x128x128_256x128x128x128_16x16_32x32_2x2_8x32x1_8x32x1_1x32x1x8_8_1x1_intrawave_v3,1395.08,603.82,0.0
256,10831,3072,6144,ck,0,0,296.3719,a8w8_blockscale_1x128x128_256x128x128x128_16x16_32x32_2x2_8x32x1_8x32x1_1x32x1x8_8_1x1_intrawave_v3,1379.54,512.75,0.0
256,10831,8192,3072,ck,0,0,390.4857,a8w8_blockscale_1x128x128_256x128x128x128_16x16_32x32_2x2_8x32x1_8x32x1_1x32x1x8_8_1x1_intrawave_v3,1396.06,604.1,0.0
256,10847,3072,6144,ck,0,0,298.2805,a8w8_blockscale_1x128x128_256x128x128x128_16x16_32x32_2x2_8x32x1_8x32x1_1x32x1x8_8_1x1_intrawave_v3,1372.74,510.13,0.0
256,10847,8192,3072,ck,0,0,391.2697,a8w8_blockscale_1x128x128_256x128x128x128_16x16_32x32_2x2_8x32x1_8x32x1_1x32x1x8_8_1x1_intrawave_v3,1395.32,603.69,0.0
256,10960,3072,6144,ck,0,0,301.839,a8w8_blockscale_1x128x128_256x128x128x128_16x16_32x32_2x2_8x32x1_8x32x1_1x32x1x8_8_1x1_intrawave_v3,1370.68,508.72,0.0
256,10960,8192,3072,ck,0,0,391.1634,a8w8_blockscale_1x128x128_256x128x128x128_16x16_32x32_2x2_8x32x1_8x32x1_1x32x1x8_8_1x1_intrawave_v3,1410.24,609.47,0.0
256,11304,3072,6144,ck,0,0,314.9265,a8w8_blockscale_1x128x128_256x128x128x128_16x16_32x32_2x2_8x32x1_8x32x1_1x32x1x8_8_1x1_intrawave_v3,1354.96,501.0,0.0
256,11304,8192,3072,ck,0,0,406.3234,a8w8_blockscale_1x128x128_256x128x128x128_16x16_32x32_2x2_8x32x1_8x32x1_1x32x1x8_8_1x1_intrawave_v3,1400.24,603.21,0.0
256,11342,3072,6144,ck,0,0,316.8621,a8w8_blockscale_1x128x128_256x128x128x128_16x16_32x32_2x2_8x32x1_8x32x1_1x32x1x8_8_1x1_intrawave_v3,1351.21,499.41,0.0
256,11342,8192,3072,ck,0,0,403.0978,a8w8_blockscale_1x128x128_256x128x128x128_16x16_32x32_2x2_8x32x1_8x32x1_1x32x1x8_8_1x1_intrawave_v3,1416.19,609.87,0.0
256,11734,3072,6144,ck,0,0,320.1867,a8w8_blockscale_1x128x128_256x128x128x128_16x16_32x32_2x2_8x32x1_8x32x1_1x32x1x8_8_1x1_intrawave_v3,1383.39,509.27,0.0
256,11734,8192,3072,ck,0,0,411.5355,a8w8_blockscale_1x128x128_256x128x128x128_16x16_32x32_2x2_8x32x1_8x32x1_1x32x1x8_8_1x1_intrawave_v3,1435.09,615.89,0.0
256,11749,3072,6144,ck,0,0,318.2575,a8w8_blockscale_1x128x128_256x128x128x128_16x16_32x32_2x2_8x32x1_8x32x1_1x32x1x8_8_1x1_intrawave_v3,1393.56,512.94,0.0
256,11749,8192,3072,ck,0,0,408.3846,a8w8_blockscale_1x128x128_256x128x128x128_16x16_32x32_2x2_8x32x1_8x32x1_1x32x1x8_8_1x1_intrawave_v3,1448.01,621.36,0.0
256,12004,3072,6144,ck,0,0,321.5859,a8w8_blockscale_1x128x128_256x128x128x128_16x16_32x32_2x2_8x32x1_8x32x1_1x32x1x8_8_1x1_intrawave_v3,1409.07,517.37,0.0
256,12004,8192,3072,ck,0,0,422.9539,a8w8_blockscale_1x128x128_256x128x128x128_16x16_32x32_2x2_8x32x1_8x32x1_1x32x1x8_8_1x1_intrawave_v3,1428.48,611.69,0.0
256,12286,3072,6144,ck,0,0,326.3691,a8w8_blockscale_1x128x128_256x128x128x128_16x16_32x32_2x2_8x32x1_8x32x1_1x32x1x8_8_1x1_intrawave_v3,1421.03,520.41,0.0
256,12286,8192,3072,ck,0,0,427.2331,a8w8_blockscale_1x128x128_256x128x128x128_16x16_32x32_2x2_8x32x1_8x32x1_1x32x1x8_8_1x1_intrawave_v3,1447.39,618.4,0.0
256,12607,3072,6144,ck,0,0,346.2144,a8w8_blockscale_1x128x128_256x128x128x128_16x16_32x32_2x2_8x32x1_8x32x1_1x32x1x8_8_1x1_intrawave_v3,1374.58,501.97,0.0
256,12607,8192,3072,ck,0,0,444.0415,a8w8_blockscale_1x128x128_256x128x128x128_16x16_32x32_2x2_8x32x1_8x32x1_1x32x1x8_8_1x1_intrawave_v3,1428.99,609.06,0.0
256,12935,3072,6144,ck,0,0,351.2184,a8w8_blockscale_1x128x128_256x128x128x128_16x16_32x32_2x2_8x32x1_8x32x1_1x32x1x8_8_1x1_intrawave_v3,1390.25,506.29,0.0
256,12935,8192,3072,ck,0,0,456.7544,a8w8_blockscale_1x128x128_256x128x128x128_16x16_32x32_2x2_8x32x1_8x32x1_1x32x1x8_8_1x1_intrawave_v3,1425.36,606.08,0.0
256,13458,3072,6144,ck,0,0,355.7212,a8w8_blockscale_1x128x128_256x128x128x128_16x16_32x32_2x2_8x32x1_8x32x1_1x32x1x8_8_1x1_intrawave_v3,1428.15,517.95,0.0
256,13458,8192,3072,ck,0,0,475.0185,a8w8_blockscale_1x128x128_256x128x128x128_16x16_32x32_2x2_8x32x1_8x32x1_1x32x1x8_8_1x1_intrawave_v3,1425.97,604.2,0.0
256,13600,3072,6144,ck,0,0,367.3921,a8w8_blockscale_1x128x128_256x128x128x128_16x16_32x32_2x2_8x32x1_8x32x1_1x32x1x8_8_1x1_intrawave_v3,1397.37,506.25,0.0
256,13600,8192,3072,ck,0,0,480.7182,a8w8_blockscale_1x128x128_256x128x128x128_16x16_32x32_2x2_8x32x1_8x32x1_1x32x1x8_8_1x1_intrawave_v3,1423.93,602.78,0.0
256,13616,3072,6144,ck,0,0,367.6805,a8w8_blockscale_1x128x128_256x128x128x128_16x16_32x32_2x2_8x32x1_8x32x1_1x32x1x8_8_1x1_intrawave_v3,1397.92,506.38,0.0
256,13616,8192,3072,ck,0,0,472.7817,a8w8_blockscale_1x128x128_256x128x128x128_16x16_32x32_2x2_8x32x1_8x32x1_1x32x1x8_8_1x1_intrawave_v3,1449.54,613.56,0.0
256,13808,3072,6144,ck,0,0,376.1302,a8w8_blockscale_1x128x128_256x128x128x128_16x16_32x32_2x2_8x32x1_8x32x1_1x32x1x8_8_1x1_intrawave_v3,1385.78,501.28,0.0
256,13808,8192,3072,ck,0,0,478.8934,a8w8_blockscale_1x128x128_256x128x128x128_16x16_32x32_2x2_8x32x1_8x32x1_1x32x1x8_8_1x1_intrawave_v3,1451.22,613.53,0.0
256,13828,3072,6144,ck,0,0,376.6482,a8w8_blockscale_1x128x128_256x128x128x128_16x16_32x32_2x2_8x32x1_8x32x1_1x32x1x8_8_1x1_intrawave_v3,1385.88,501.24,0.0
256,13828,8192,3072,ck,0,0,478.7901,a8w8_blockscale_1x128x128_256x128x128x128_16x16_32x32_2x2_8x32x1_8x32x1_1x32x1x8_8_1x1_intrawave_v3,1453.63,614.47,0.0
256,13848,3072,6144,ck,0,0,376.709,a8w8_blockscale_1x128x128_256x128x128x128_16x16_32x32_2x2_8x32x1_8x32x1_1x32x1x8_8_1x1_intrawave_v3,1387.66,501.82,0.0
256,13848,8192,3072,ck,0,0,476.4549,a8w8_blockscale_1x128x128_256x128x128x128_16x16_32x32_2x2_8x32x1_8x32x1_1x32x1x8_8_1x1_intrawave_v3,1462.87,618.3,0.0
256,13916,3072,6144,ck,0,0,378.0738,a8w8_blockscale_1x128x128_256x128x128x128_16x16_32x32_2x2_8x32x1_8x32x1_1x32x1x8_8_1x1_intrawave_v3,1389.44,502.21,0.0
256,13916,8192,3072,ck,0,0,478.7146,a8w8_blockscale_1x128x128_256x128x128x128_16x16_32x32_2x2_8x32x1_8x32x1_1x32x1x8_8_1x1_intrawave_v3,1463.12,618.15,0.0
256,13933,3072,6144,ck,0,0,385.9758,a8w8_blockscale_1x128x128_256x128x128x128_16x16_32x32_2x2_8x32x1_8x32x1_1x32x1x8_8_1x1_intrawave_v3,1362.66,492.47,0.0
256,13933,8192,3072,ck,0,0,487.2419,a8w8_blockscale_1x128x128_256x128x128x128_16x16_32x32_2x2_8x32x1_8x32x1_1x32x1x8_8_1x1_intrawave_v3,1439.27,608.01,0.0
256,13935,3072,6144,ck,0,0,376.1009,a8w8_blockscale_1x128x128_256x128x128x128_16x16_32x32_2x2_8x32x1_8x32x1_1x32x1x8_8_1x1_intrawave_v3,1398.64,505.47,0.0
256,13935,8192,3072,ck,0,0,481.0693,a8w8_blockscale_1x128x128_256x128x128x128_16x16_32x32_2x2_8x32x1_8x32x1_1x32x1x8_8_1x1_intrawave_v3,1457.94,615.89,0.0
256,13937,3072,6144,ck,0,0,379.0917,a8w8_blockscale_1x128x128_256x128x128x128_16x16_32x32_2x2_8x32x1_8x32x1_1x32x1x8_8_1x1_intrawave_v3,1387.8,501.55,0.0
256,13937,8192,3072,ck,0,0,480.3924,a8w8_blockscale_1x128x128_256x128x128x128_16x16_32x32_2x2_8x32x1_8x32x1_1x32x1x8_8_1x1_intrawave_v3,1460.21,616.84,0.0
256,13938,3072,6144,ck,0,0,375.3924,a8w8_blockscale_1x128x128_256x128x128x128_16x16_32x32_2x2_8x32x1_8x32x1_1x32x1x8_8_1x1_intrawave_v3,1401.58,506.52,0.0
256,13938,8192,3072,ck,0,0,486.1449,a8w8_blockscale_1x128x128_256x128x128x128_16x16_32x32_2x2_8x32x1_8x32x1_1x32x1x8_8_1x1_intrawave_v3,1443.03,609.58,0.0
256,13940,3072,6144,ck,0,0,375.6372,a8w8_blockscale_1x128x128_256x128x128x128_16x16_32x32_2x2_8x32x1_8x32x1_1x32x1x8_8_1x1_intrawave_v3,1400.87,506.26,0.0
256,13940,8192,3072,ck,0,0,475.7364,a8w8_blockscale_1x128x128_256x128x128x128_16x16_32x32_2x2_8x32x1_8x32x1_1x32x1x8_8_1x1_intrawave_v3,1474.81,623.0,0.0
256,13950,3072,6144,ck,0,0,379.2684,a8w8_blockscale_1x128x128_256x128x128x128_16x16_32x32_2x2_8x32x1_8x32x1_1x32x1x8_8_1x1_intrawave_v3,1388.45,501.73,0.0
256,13950,8192,3072,ck,0,0,477.858,a8w8_blockscale_1x128x128_256x128x128x128_16x16_32x32_2x2_8x32x1_8x32x1_1x32x1x8_8_1x1_intrawave_v3,1469.32,620.64,0.0
256,13975,3072,6144,ck,0,0,377.6304,a8w8_blockscale_1x128x128_256x128x128x128_16x16_32x32_2x2_8x32x1_8x32x1_1x32x1x8_8_1x1_intrawave_v3,1396.97,504.72,0.0
256,13975,8192,3072,ck,0,0,489.0108,a8w8_blockscale_1x128x128_256x128x128x128_16x16_32x32_2x2_8x32x1_8x32x1_1x32x1x8_8_1x1_intrawave_v3,1438.38,607.48,0.0
256,14002,3072,6144,ck,0,0,379.884,a8w8_blockscale_1x128x128_256x128x128x128_16x16_32x32_2x2_8x32x1_8x32x1_1x32x1x8_8_1x1_intrawave_v3,1391.37,502.6,0.0
256,14002,8192,3072,ck,0,0,489.8873,a8w8_blockscale_1x128x128_256x128x128x128_16x16_32x32_2x2_8x32x1_8x32x1_1x32x1x8_8_1x1_intrawave_v3,1438.58,607.46,0.0
256,14074,3072,6144,ck,0,0,383.6945,a8w8_blockscale_1x128x128_256x128x128x128_16x16_32x32_2x2_8x32x1_8x32x1_1x32x1x8_8_1x1_intrawave_v3,1384.63,499.92,0.0
256,14074,8192,3072,ck,0,0,482.586,a8w8_blockscale_1x128x128_256x128x128x128_16x16_32x32_2x2_8x32x1_8x32x1_1x32x1x8_8_1x1_intrawave_v3,1467.86,619.56,0.0
256,14117,3072,6144,ck,0,0,380.3572,a8w8_blockscale_1x128x128_256x128x128x128_16x16_32x32_2x2_8x32x1_8x32x1_1x32x1x8_8_1x1_intrawave_v3,1401.05,505.69,0.0
256,14117,8192,3072,ck,0,0,492.5348,a8w8_blockscale_1x128x128_256x128x128x128_16x16_32x32_2x2_8x32x1_8x32x1_1x32x1x8_8_1x1_intrawave_v3,1442.6,608.74,0.0
256,14119,3072,6144,ck,0,0,386.2932,a8w8_blockscale_1x128x128_256x128x128x128_16x16_32x32_2x2_8x32x1_8x32x1_1x32x1x8_8_1x1_intrawave_v3,1379.71,497.99,0.0
256,14119,8192,3072,ck,0,0,476.0843,a8w8_blockscale_1x128x128_256x128x128x128_16x16_32x32_2x2_8x32x1_8x32x1_1x32x1x8_8_1x1_intrawave_v3,1492.66,629.86,0.0
256,14121,3072,6144,ck,0,0,377.5447,a8w8_blockscale_1x128x128_256x128x128x128_16x16_32x32_2x2_8x32x1_8x32x1_1x32x1x8_8_1x1_intrawave_v3,1411.89,509.59,0.0
256,14121,8192,3072,ck,0,0,478.1848,a8w8_blockscale_1x128x128_256x128x128x128_16x16_32x32_2x2_8x32x1_8x32x1_1x32x1x8_8_1x1_intrawave_v3,1486.31,627.17,0.0
256,14123,3072,6144,ck,0,0,381.29,a8w8_blockscale_1x128x128_256x128x128x128_16x16_32x32_2x2_8x32x1_8x32x1_1x32x1x8_8_1x1_intrawave_v3,1398.22,504.65,0.0
256,14123,8192,3072,ck,0,0,472.9666,a8w8_blockscale_1x128x128_256x128x128x128_16x16_32x32_2x2_8x32x1_8x32x1_1x32x1x8_8_1x1_intrawave_v3,1502.93,634.17,0.0
256,14125,3072,6144,ck,0,0,381.5527,a8w8_blockscale_1x128x128_256x128x128x128_16x16_32x32_2x2_8x32x1_8x32x1_1x32x1x8_8_1x1_intrawave_v3,1397.45,504.37,0.0
256,14125,8192,3072,ck,0,0,475.7842,a8w8_blockscale_1x128x128_256x128x128x128_16x16_32x32_2x2_8x32x1_8x32x1_1x32x1x8_8_1x1_intrawave_v3,1494.24,630.5,0.0
256,14127,3072,6144,ck,0,0,379.5707,a8w8_blockscale_1x128x128_256x128x128x128_16x16_32x32_2x2_8x32x1_8x32x1_1x32x1x8_8_1x1_intrawave_v3,1404.95,507.06,0.0
256,14127,8192,3072,ck,0,0,475.6294,a8w8_blockscale_1x128x128_256x128x128x128_16x16_32x32_2x2_8x32x1_8x32x1_1x32x1x8_8_1x1_intrawave_v3,1494.94,630.79,0.0
256,14129,3072,6144,ck,0,0,376.3594,a8w8_blockscale_1x128x128_256x128x128x128_16x16_32x32_2x2_8x32x1_8x32x1_1x32x1x8_8_1x1_intrawave_v3,1417.13,511.46,0.0
256,14129,8192,3072,ck,0,0,478.4098,a8w8_blockscale_1x128x128_256x128x128x128_16x16_32x32_2x2_8x32x1_8x32x1_1x32x1x8_8_1x1_intrawave_v3,1486.46,627.2,0.0
256,14131,3072,6144,ck,0,0,382.7559,a8w8_blockscale_1x128x128_256x128x128x128_16x16_32x32_2x2_8x32x1_8x32x1_1x32x1x8_8_1x1_intrawave_v3,1393.65,502.97,0.0
256,14131,8192,3072,ck,0,0,482.4254,a8w8_blockscale_1x128x128_256x128x128x128_16x16_32x32_2x2_8x32x1_8x32x1_1x32x1x8_8_1x1_intrawave_v3,1474.29,622.06,0.0
256,14133,3072,6144,ck,0,0,380.4604,a8w8_blockscale_1x128x128_256x128x128x128_16x16_32x32_2x2_8x32x1_8x32x1_1x32x1x8_8_1x1_intrawave_v3,1402.26,506.07,0.0
256,14133,8192,3072,ck,0,0,481.4375,a8w8_blockscale_1x128x128_256x128x128x128_16x16_32x32_2x2_8x32x1_8x32x1_1x32x1x8_8_1x1_intrawave_v3,1477.53,623.42,0.0
256,14865,3072,6144,ck,0,0,395.7949,a8w8_blockscale_1x128x128_256x128x128x128_16x16_32x32_2x2_8x32x1_8x32x1_1x32x1x8_8_1x1_intrawave_v3,1417.74,509.19,0.0
256,14865,8192,3072,ck,0,0,519.9501,a8w8_blockscale_1x128x128_256x128x128x128_16x16_32x32_2x2_8x32x1_8x32x1_1x32x1x8_8_1x1_intrawave_v3,1438.95,604.63,0.0
256,15031,3072,6144,ck,0,0,405.1153,a8w8_blockscale_1x128x128_256x128x128x128_16x16_32x32_2x2_8x32x1_8x32x1_1x32x1x8_8_1x1_intrawave_v3,1400.59,502.51,0.0
256,15031,8192,3072,ck,0,0,520.9773,a8w8_blockscale_1x128x128_256x128x128x128_16x16_32x32_2x2_8x32x1_8x32x1_1x32x1x8_8_1x1_intrawave_v3,1452.15,609.64,0.0
256,15278,3072,6144,ck,0,0,406.5384,a8w8_blockscale_1x128x128_256x128x128x128_16x16_32x32_2x2_8x32x1_8x32x1_1x32x1x8_8_1x1_intrawave_v3,1418.62,508.22,0.0
256,15278,8192,3072,ck,0,0,525.4457,a8w8_blockscale_1x128x128_256x128x128x128_16x16_32x32_2x2_8x32x1_8x32x1_1x32x1x8_8_1x1_intrawave_v3,1463.46,613.6,0.0
256,15303,3072,6144,ck,0,0,407.12,a8w8_blockscale_1x128x128_256x128x128x128_16x16_32x32_2x2_8x32x1_8x32x1_1x32x1x8_8_1x1_intrawave_v3,1418.92,508.25,0.0
256,15303,8192,3072,ck,0,0,512.1352,a8w8_blockscale_1x128x128_256x128x128x128_16x16_32x32_2x2_8x32x1_8x32x1_1x32x1x8_8_1x1_intrawave_v3,1503.95,630.5,0.0
256,15519,3072,6144,ck,0,0,410.3288,a8w8_blockscale_1x128x128_256x128x128x128_16x16_32x32_2x2_8x32x1_8x32x1_1x32x1x8_8_1x1_intrawave_v3,1427.69,510.74,0.0
256,15519,8192,3072,ck,0,0,533.6553,a8w8_blockscale_1x128x128_256x128x128x128_16x16_32x32_2x2_8x32x1_8x32x1_1x32x1x8_8_1x1_intrawave_v3,1463.67,612.95,0.0
256,15524,3072,6144,ck,0,0,410.6596,a8w8_blockscale_1x128x128_256x128x128x128_16x16_32x32_2x2_8x32x1_8x32x1_1x32x1x8_8_1x1_intrawave_v3,1427.0,510.48,0.0
256,15524,8192,3072,ck,0,0,525.7856,a8w8_blockscale_1x128x128_256x128x128x128_16x16_32x32_2x2_8x32x1_8x32x1_1x32x1x8_8_1x1_intrawave_v3,1486.06,622.31,0.0
256,15575,3072,6144,ck,0,0,409.9736,a8w8_blockscale_1x128x128_256x128x128x128_16x16_32x32_2x2_8x32x1_8x32x1_1x32x1x8_8_1x1_intrawave_v3,1434.08,512.86,0.0
256,15575,8192,3072,ck,0,0,522.698,a8w8_blockscale_1x128x128_256x128x128x128_16x16_32x32_2x2_8x32x1_8x32x1_1x32x1x8_8_1x1_intrawave_v3,1499.75,627.88,0.0
256,15595,3072,6144,ck,0,0,414.7288,a8w8_blockscale_1x128x128_256x128x128x128_16x16_32x32_2x2_8x32x1_8x32x1_1x32x1x8_8_1x1_intrawave_v3,1419.46,507.57,0.0
256,15595,8192,3072,ck,0,0,529.8166,a8w8_blockscale_1x128x128_256x128x128x128_16x16_32x32_2x2_8x32x1_8x32x1_1x32x1x8_8_1x1_intrawave_v3,1481.5,620.18,0.0
256,15615,3072,6144,ck,0,0,411.2488,a8w8_blockscale_1x128x128_256x128x128x128_16x16_32x32_2x2_8x32x1_8x32x1_1x32x1x8_8_1x1_intrawave_v3,1433.31,512.47,0.0
256,15615,8192,3072,ck,0,0,528.7007,a8w8_blockscale_1x128x128_256x128x128x128_16x16_32x32_2x2_8x32x1_8x32x1_1x32x1x8_8_1x1_intrawave_v3,1486.53,622.23,0.0
256,15702,3072,6144,ck,0,0,411.8672,a8w8_blockscale_1x128x128_256x128x128x128_16x16_32x32_2x2_8x32x1_8x32x1_1x32x1x8_8_1x1_intrawave_v3,1439.13,514.29,0.0
256,15702,8192,3072,ck,0,0,536.5821,a8w8_blockscale_1x128x128_256x128x128x128_16x16_32x32_2x2_8x32x1_8x32x1_1x32x1x8_8_1x1_intrawave_v3,1472.85,616.24,0.0
256,15724,3072,6144,ck,0,0,415.5792,a8w8_blockscale_1x128x128_256x128x128x128_16x16_32x32_2x2_8x32x1_8x32x1_1x32x1x8_8_1x1_intrawave_v3,1428.27,510.35,0.0
256,15724,8192,3072,ck,0,0,540.0941,a8w8_blockscale_1x128x128_256x128x128x128_16x16_32x32_2x2_8x32x1_8x32x1_1x32x1x8_8_1x1_intrawave_v3,1465.33,613.03,0.0
256,15747,3072,6144,ck,0,0,414.2972,a8w8_blockscale_1x128x128_256x128x128x128_16x16_32x32_2x2_8x32x1_8x32x1_1x32x1x8_8_1x1_intrawave_v3,1434.79,512.61,0.0
256,15747,8192,3072,ck,0,0,545.5177,a8w8_blockscale_1x128x128_256x128x128x128_16x16_32x32_2x2_8x32x1_8x32x1_1x32x1x8_8_1x1_intrawave_v3,1452.88,607.75,0.0
256,15770,3072,6144,ck,0,0,416.87,a8w8_blockscale_1x128x128_256x128x128x128_16x16_32x32_2x2_8x32x1_8x32x1_1x32x1x8_8_1x1_intrawave_v3,1428.02,510.13,0.0
256,15770,8192,3072,ck,0,0,534.9912,a8w8_blockscale_1x128x128_256x128x128x128_16x16_32x32_2x2_8x32x1_8x32x1_1x32x1x8_8_1x1_intrawave_v3,1483.63,620.55,0.0
256,15793,3072,6144,ck,0,0,415.0108,a8w8_blockscale_1x128x128_256x128x128x128_16x16_32x32_2x2_8x32x1_8x32x1_1x32x1x8_8_1x1_intrawave_v3,1436.51,513.09,0.0
256,15793,8192,3072,ck,0,0,527.0856,a8w8_blockscale_1x128x128_256x128x128x128_16x16_32x32_2x2_8x32x1_8x32x1_1x32x1x8_8_1x1_intrawave_v3,1508.08,630.7,0.0
256,15816,3072,6144,ck,0,0,419.2056,a8w8_blockscale_1x128x128_256x128x128x128_16x16_32x32_2x2_8x32x1_8x32x1_1x32x1x8_8_1x1_intrawave_v3,1424.2,508.63,0.0
256,15816,8192,3072,ck,0,0,539.0232,a8w8_blockscale_1x128x128_256x128x128x128_16x16_32x32_2x2_8x32x1_8x32x1_1x32x1x8_8_1x1_intrawave_v3,1476.83,617.57,0.0
256,15839,3072,6144,ck,0,0,415.9159,a8w8_blockscale_1x128x128_256x128x128x128_16x16_32x32_2x2_8x32x1_8x32x1_1x32x1x8_8_1x1_intrawave_v3,1437.56,513.33,0.0
256,15839,8192,3072,ck,0,0,541.3708,a8w8_blockscale_1x128x128_256x128x128x128_16x16_32x32_2x2_8x32x1_8x32x1_1x32x1x8_8_1x1_intrawave_v3,1472.56,615.71,0.0
256,16001,3072,6144,ck,0,0,425.0848,a8w8_blockscale_1x128x128_256x128x128x128_16x16_32x32_2x2_8x32x1_8x32x1_1x32x1x8_8_1x1_intrawave_v3,1420.93,506.95,0.0
256,16001,8192,3072,ck,0,0,545.9584,a8w8_blockscale_1x128x128_256x128x128x128_16x16_32x32_2x2_8x32x1_8x32x1_1x32x1x8_8_1x1_intrawave_v3,1475.12,616.31,0.0
256,16250,3072,6144,ck,0,0,426.8568,a8w8_blockscale_1x128x128_256x128x128x128_16x16_32x32_2x2_8x32x1_8x32x1_1x32x1x8_8_1x1_intrawave_v3,1437.06,512.01,0.0
256,16250,8192,3072,ck,0,0,562.4865,a8w8_blockscale_1x128x128_256x128x128x128_16x16_32x32_2x2_8x32x1_8x32x1_1x32x1x8_8_1x1_intrawave_v3,1454.06,606.82,0.0
256,16298,3072,6144,ck,0,0,426.0796,a8w8_blockscale_1x128x128_256x128x128x128_16x16_32x32_2x2_8x32x1_8x32x1_1x32x1x8_8_1x1_intrawave_v3,1443.93,514.33,0.0
256,16298,8192,3072,ck,0,0,556.6069,a8w8_blockscale_1x128x128_256x128x128x128_16x16_32x32_2x2_8x32x1_8x32x1_1x32x1x8_8_1x1_intrawave_v3,1473.76,614.9,0.0
256,16384,512,7168,cktile,11,0,98.713,a8w8_blockscale_cktile_192x256x128_4x2x1_16x16x128_intrawave_0x1x0_1,1218.27,1396.85,0.0
256,17237,8192,3072,ck,0,0,591.0056,a8w8_blockscale_1x128x128_256x128x128x128_16x16_32x32_2x2_8x32x1_8x32x1_1x32x1x8_8_1x1_intrawave_v3,1467.95,610.03,0.0
256,17292,8192,3072,ck,0,0,593.0647,a8w8_blockscale_1x128x128_256x128x128x128_16x16_32x32_2x2_8x32x1_8x32x1_1x32x1x8_8_1x1_intrawave_v3,1467.52,609.71,0.0
256,18046,8192,3072,ck,0,0,604.7856,a8w8_blockscale_1x128x128_256x128x128x128_16x16_32x32_2x2_8x32x1_8x32x1_1x32x1x8_8_1x1_intrawave_v3,1501.83,622.15,0.0
256,18091,8192,3072,ck,0,0,607.924,a8w8_blockscale_1x128x128_256x128x128x128_16x16_32x32_2x2_8x32x1_8x32x1_1x32x1x8_8_1x1_intrawave_v3,1497.8,620.38,0.0
256,18955,8192,3072,ck,0,0,645.7634,a8w8_blockscale_1x128x128_256x128x128x128_16x16_32x32_2x2_8x32x1_8x32x1_1x32x1x8_8_1x1_intrawave_v3,1477.38,610.06,0.0
256,18978,8192,3072,ck,0,0,654.8643,a8w8_blockscale_1x128x128_256x128x128x128_16x16_32x32_2x2_8x32x1_8x32x1_1x32x1x8_8_1x1_intrawave_v3,1458.61,602.26,0.0
256,19001,8192,3072,ck,0,0,645.5526,a8w8_blockscale_1x128x128_256x128x128x128_16x16_32x32_2x2_8x32x1_8x32x1_1x32x1x8_8_1x1_intrawave_v3,1481.45,611.65,0.0
256,19024,8192,3072,ck,0,0,635.5907,a8w8_blockscale_1x128x128_256x128x128x128_16x16_32x32_2x2_8x32x1_8x32x1_1x32x1x8_8_1x1_intrawave_v3,1506.49,621.94,0.0
256,19670,8192,3072,ck,0,0,643.7016,a8w8_blockscale_1x128x128_256x128x128x128_16x16_32x32_2x2_8x32x1_8x32x1_1x32x1x8_8_1x1_intrawave_v3,1538.02,633.62,0.0
256,20043,8192,3072,ck,0,0,679.0872,a8w8_blockscale_1x128x128_256x128x128x128_16x16_32x32_2x2_8x32x1_8x32x1_1x32x1x8_8_1x1_intrawave_v3,1485.52,611.29,0.0
256,20131,8192,3072,ck,0,0,674.42,a8w8_blockscale_1x128x128_256x128x128x128_16x16_32x32_2x2_8x32x1_8x32x1_1x32x1x8_8_1x1_intrawave_v3,1502.37,618.06,0.0
256,20297,8192,3072,ck,0,0,663.5456,a8w8_blockscale_1x128x128_256x128x128x128_16x16_32x32_2x2_8x32x1_8x32x1_1x32x1x8_8_1x1_intrawave_v3,1539.58,633.06,0.0
256,20329,8192,3072,ck,0,0,666.0266,a8w8_blockscale_1x128x128_256x128x128x128_16x16_32x32_2x2_8x32x1_8x32x1_1x32x1x8_8_1x1_intrawave_v3,1536.26,631.64,0.0
256,20480,512,7168,cktile,27,0,95.1492,a8w8_blockscale_cktile_192x256x128_4x2x1_16x16x128_intrawave_0x1x0_3,1579.88,1801.82,0.0
256,20626,8192,3072,ck,0,0,693.8637,a8w8_blockscale_1x128x128_256x128x128x128_16x16_32x32_2x2_8x32x1_8x32x1_1x32x1x8_8_1x1_intrawave_v3,1496.17,614.62,0.0
256,20631,8192,3072,ck,0,0,682.3364,a8w8_blockscale_1x128x128_256x128x128x128_16x16_32x32_2x2_8x32x1_8x32x1_1x32x1x8_8_1x1_intrawave_v3,1521.82,625.15,0.0
256,20633,8192,3072,ck,0,0,687.5973,a8w8_blockscale_1x128x128_256x128x128x128_16x16_32x32_2x2_8x32x1_8x32x1_1x32x1x8_8_1x1_intrawave_v3,1510.32,620.42,0.0
256,20635,8192,3072,ck,0,0,696.7482,a8w8_blockscale_1x128x128_256x128x128x128_16x16_32x32_2x2_8x32x1_8x32x1_1x32x1x8_8_1x1_intrawave_v3,1490.63,612.33,0.0
256,20638,8192,3072,ck,0,0,686.6312,a8w8_blockscale_1x128x128_256x128x128x128_16x16_32x32_2x2_8x32x1_8x32x1_1x32x1x8_8_1x1_intrawave_v3,1512.81,621.44,0.0
256,20649,8192,3072,ck,0,0,674.8058,a8w8_blockscale_1x128x128_256x128x128x128_16x16_32x32_2x2_8x32x1_8x32x1_1x32x1x8_8_1x1_intrawave_v3,1540.14,632.65,0.0
256,20650,8192,3072,ck,0,0,675.5371,a8w8_blockscale_1x128x128_256x128x128x128_16x16_32x32_2x2_8x32x1_8x32x1_1x32x1x8_8_1x1_intrawave_v3,1538.55,631.99,0.0
256,20672,8192,3072,ck,0,0,685.7934,a8w8_blockscale_1x128x128_256x128x128x128_16x16_32x32_2x2_8x32x1_8x32x1_1x32x1x8_8_1x1_intrawave_v3,1517.16,623.16,0.0
256,20676,8192,3072,ck,0,0,694.7825,a8w8_blockscale_1x128x128_256x128x128x128_16x16_32x32_2x2_8x32x1_8x32x1_1x32x1x8_8_1x1_intrawave_v3,1497.82,615.21,0.0
256,20696,8192,3072,ck,0,0,701.0304,a8w8_blockscale_1x128x128_256x128x128x128_16x16_32x32_2x2_8x32x1_8x32x1_1x32x1x8_8_1x1_intrawave_v3,1485.9,610.28,0.0
256,20719,8192,3072,ck,0,0,701.6852,a8w8_blockscale_1x128x128_256x128x128x128_16x16_32x32_2x2_8x32x1_8x32x1_1x32x1x8_8_1x1_intrawave_v3,1486.17,610.35,0.0
256,20743,8192,3072,ck,0,0,698.9843,a8w8_blockscale_1x128x128_256x128x128x128_16x16_32x32_2x2_8x32x1_8x32x1_1x32x1x8_8_1x1_intrawave_v3,1493.64,613.38,0.0
256,20773,8192,3072,ck,0,0,694.4298,a8w8_blockscale_1x128x128_256x128x128x128_16x16_32x32_2x2_8x32x1_8x32x1_1x32x1x8_8_1x1_intrawave_v3,1505.61,618.24,0.0
256,20801,8192,3072,ck,0,0,717.0369,a8w8_blockscale_1x128x128_256x128x128x128_16x16_32x32_2x2_8x32x1_8x32x1_1x32x1x8_8_1x1_intrawave_v3,1460.1,599.51,0.0
256,20806,8192,3072,ck,0,0,689.8522,a8w8_blockscale_1x128x128_256x128x128x128_16x16_32x32_2x2_8x32x1_8x32x1_1x32x1x8_8_1x1_intrawave_v3,1518.01,623.27,0.0
256,20815,8192,3072,ck,0,0,701.0792,a8w8_blockscale_1x128x128_256x128x128x128_16x16_32x32_2x2_8x32x1_8x32x1_1x32x1x8_8_1x1_intrawave_v3,1494.34,613.54,0.0
256,20817,8192,3072,ck,0,0,698.1969,a8w8_blockscale_1x128x128_256x128x128x128_16x16_32x32_2x2_8x32x1_8x32x1_1x32x1x8_8_1x1_intrawave_v3,1500.66,616.13,0.0
256,20847,8192,3072,ck,0,0,698.2274,a8w8_blockscale_1x128x128_256x128x128x128_16x16_32x32_2x2_8x32x1_8x32x1_1x32x1x8_8_1x1_intrawave_v3,1502.75,616.94,0.0
256,20849,8192,3072,ck,0,0,703.2874,a8w8_blockscale_1x128x128_256x128x128x128_16x16_32x32_2x2_8x32x1_8x32x1_1x32x1x8_8_1x1_intrawave_v3,1492.08,612.56,0.0
256,20851,8192,3072,ck,0,0,698.0519,a8w8_blockscale_1x128x128_256x128x128x128_16x16_32x32_2x2_8x32x1_8x32x1_1x32x1x8_8_1x1_intrawave_v3,1503.42,617.21,0.0
256,20853,8192,3072,ck,0,0,690.8892,a8w8_blockscale_1x128x128_256x128x128x128_16x16_32x32_2x2_8x32x1_8x32x1_1x32x1x8_8_1x1_intrawave_v3,1519.15,623.66,0.0
256,20855,8192,3072,ck,0,0,681.7009,a8w8_blockscale_1x128x128_256x128x128x128_16x16_32x32_2x2_8x32x1_8x32x1_1x32x1x8_8_1x1_intrawave_v3,1539.78,632.13,0.0
256,20857,8192,3072,ck,0,0,696.5038,a8w8_blockscale_1x128x128_256x128x128x128_16x16_32x32_2x2_8x32x1_8x32x1_1x32x1x8_8_1x1_intrawave_v3,1507.2,618.75,0.0
256,20861,8192,3072,ck,0,0,703.6294,a8w8_blockscale_1x128x128_256x128x128x128_16x16_32x32_2x2_8x32x1_8x32x1_1x32x1x8_8_1x1_intrawave_v3,1492.22,612.59,0.0
256,20910,8192,3072,ck,0,0,704.0504,a8w8_blockscale_1x128x128_256x128x128x128_16x16_32x32_2x2_8x32x1_8x32x1_1x32x1x8_8_1x1_intrawave_v3,1494.83,613.58,0.0
256,21010,8192,3072,ck,0,0,710.6617,a8w8_blockscale_1x128x128_256x128x128x128_16x16_32x32_2x2_8x32x1_8x32x1_1x32x1x8_8_1x1_intrawave_v3,1488.0,610.61,0.0
256,21011,8192,3072,ck,0,0,690.3609,a8w8_blockscale_1x128x128_256x128x128x128_16x16_32x32_2x2_8x32x1_8x32x1_1x32x1x8_8_1x1_intrawave_v3,1531.83,628.59,0.0
256,21041,8192,3072,ck,0,0,691.0968,a8w8_blockscale_1x128x128_256x128x128x128_16x16_32x32_2x2_8x32x1_8x32x1_1x32x1x8_8_1x1_intrawave_v3,1532.39,628.77,0.0
256,21043,8192,3072,ck,0,0,693.4205,a8w8_blockscale_1x128x128_256x128x128x128_16x16_32x32_2x2_8x32x1_8x32x1_1x32x1x8_8_1x1_intrawave_v3,1527.4,626.72,0.0
256,21045,8192,3072,ck,0,0,706.7264,a8w8_blockscale_1x128x128_256x128x128x128_16x16_32x32_2x2_8x32x1_8x32x1_1x32x1x8_8_1x1_intrawave_v3,1498.78,614.97,0.0
256,21048,8192,3072,ck,0,0,713.3356,a8w8_blockscale_1x128x128_256x128x128x128_16x16_32x32_2x2_8x32x1_8x32x1_1x32x1x8_8_1x1_intrawave_v3,1485.11,609.36,0.0
256,21184,8192,3072,ck,0,0,715.2605,a8w8_blockscale_1x128x128_256x128x128x128_16x16_32x32_2x2_8x32x1_8x32x1_1x32x1x8_8_1x1_intrawave_v3,1490.68,611.42,0.0
256,21191,8192,3072,ck,0,0,711.2165,a8w8_blockscale_1x128x128_256x128x128x128_16x16_32x32_2x2_8x32x1_8x32x1_1x32x1x8_8_1x1_intrawave_v3,1499.65,615.08,0.0
256,21209,8192,3072,ck,0,0,712.2073,a8w8_blockscale_1x128x128_256x128x128x128_16x16_32x32_2x2_8x32x1_8x32x1_1x32x1x8_8_1x1_intrawave_v3,1498.84,614.72,0.0
256,21213,8192,3072,ck,0,0,695.551,a8w8_blockscale_1x128x128_256x128x128x128_16x16_32x32_2x2_8x32x1_8x32x1_1x32x1x8_8_1x1_intrawave_v3,1535.02,629.55,0.0
256,21228,8192,3072,ck,0,0,719.4311,a8w8_blockscale_1x128x128_256x128x128x128_16x16_32x32_2x2_8x32x1_8x32x1_1x32x1x8_8_1x1_intrawave_v3,1485.12,609.06,0.0
256,21230,8192,3072,ck,0,0,711.9441,a8w8_blockscale_1x128x128_256x128x128x128_16x16_32x32_2x2_8x32x1_8x32x1_1x32x1x8_8_1x1_intrawave_v3,1500.88,615.52,0.0
256,21232,8192,3072,ck,0,0,706.6636,a8w8_blockscale_1x128x128_256x128x128x128_16x16_32x32_2x2_8x32x1_8x32x1_1x32x1x8_8_1x1_intrawave_v3,1512.24,620.18,0.0
256,21234,8192,3072,ck,0,0,711.2627,a8w8_blockscale_1x128x128_256x128x128x128_16x16_32x32_2x2_8x32x1_8x32x1_1x32x1x8_8_1x1_intrawave_v3,1502.6,616.22,0.0
256,21236,8192,3072,ck,0,0,692.1609,a8w8_blockscale_1x128x128_256x128x128x128_16x16_32x32_2x2_8x32x1_8x32x1_1x32x1x8_8_1x1_intrawave_v3,1544.21,633.28,0.0
256,21238,8192,3072,ck,0,0,708.6326,a8w8_blockscale_1x128x128_256x128x128x128_16x16_32x32_2x2_8x32x1_8x32x1_1x32x1x8_8_1x1_intrawave_v3,1508.46,618.62,0.0
256,21240,8192,3072,ck,0,0,715.9919,a8w8_blockscale_1x128x128_256x128x128x128_16x16_32x32_2x2_8x32x1_8x32x1_1x32x1x8_8_1x1_intrawave_v3,1493.1,612.31,0.0
256,21242,8192,3072,ck,0,0,720.5643,a8w8_blockscale_1x128x128_256x128x128x128_16x16_32x32_2x2_8x32x1_8x32x1_1x32x1x8_8_1x1_intrawave_v3,1483.76,608.48,0.0
256,21244,8192,3072,ck,0,0,695.7377,a8w8_blockscale_1x128x128_256x128x128x128_16x16_32x32_2x2_8x32x1_8x32x1_1x32x1x8_8_1x1_intrawave_v3,1536.85,630.25,0.0
256,21705,8192,3072,ck,0,0,730.8545,a8w8_blockscale_1x128x128_256x128x128x128_16x16_32x32_2x2_8x32x1_8x32x1_1x32x1x8_8_1x1_intrawave_v3,1494.76,612.24,0.0
256,22010,8192,3072,ck,0,0,738.2893,a8w8_blockscale_1x128x128_256x128x128x128_16x16_32x32_2x2_8x32x1_8x32x1_1x32x1x8_8_1x1_intrawave_v3,1500.5,614.11,0.0
256,22040,8192,3072,ck,0,0,743.741,a8w8_blockscale_1x128x128_256x128x128x128_16x16_32x32_2x2_8x32x1_8x32x1_1x32x1x8_8_1x1_intrawave_v3,1491.53,610.4,0.0
256,22188,8192,3072,ck,0,0,725.4702,a8w8_blockscale_1x128x128_256x128x128x128_16x16_32x32_2x2_8x32x1_8x32x1_1x32x1x8_8_1x1_intrawave_v3,1539.36,629.74,0.0
256,23010,8192,3072,ck,0,0,751.3183,a8w8_blockscale_1x128x128_256x128x128x128_16x16_32x32_2x2_8x32x1_8x32x1_1x32x1x8_8_1x1_intrawave_v3,1541.47,629.36,0.0
256,23309,8192,3072,ck,0,0,763.7489,a8w8_blockscale_1x128x128_256x128x128x128_16x16_32x32_2x2_8x32x1_8x32x1_1x32x1x8_8_1x1_intrawave_v3,1536.08,626.73,0.0
256,23671,8192,3072,ck,0,0,773.7604,a8w8_blockscale_1x128x128_256x128x128x128_16x16_32x32_2x2_8x32x1_8x32x1_1x32x1x8_8_1x1_intrawave_v3,1539.75,627.73,0.0
256,25002,8192,3072,ck,0,0,836.2877,a8w8_blockscale_1x128x128_256x128x128x128_16x16_32x32_2x2_8x32x1_8x32x1_1x32x1x8_8_1x1_intrawave_v3,1504.74,611.76,0.0
256,25003,8192,3072,ck,0,0,842.0985,a8w8_blockscale_1x128x128_256x128x128x128_16x16_32x32_2x2_8x32x1_8x32x1_1x32x1x8_8_1x1_intrawave_v3,1494.41,607.56,0.0
256,25014,8192,3072,ck,0,0,819.331,a8w8_blockscale_1x128x128_256x128x128x128_16x16_32x32_2x2_8x32x1_8x32x1_1x32x1x8_8_1x1_intrawave_v3,1536.61,624.7,0.0
256,25276,8192,3072,ck,0,0,846.0665,a8w8_blockscale_1x128x128_256x128x128x128_16x16_32x32_2x2_8x32x1_8x32x1_1x32x1x8_8_1x1_intrawave_v3,1503.64,610.99,0.0
256,25284,8192,3072,ck,0,0,845.8352,a8w8_blockscale_1x128x128_256x128x128x128_16x16_32x32_2x2_8x32x1_8x32x1_1x32x1x8_8_1x1_intrawave_v3,1504.53,611.34,0.0
256,25404,8192,3072,ck,0,0,828.2556,a8w8_blockscale_1x128x128_256x128x128x128_16x16_32x32_2x2_8x32x1_8x32x1_1x32x1x8_8_1x1_intrawave_v3,1543.76,627.13,0.0
256,25414,8192,3072,ck,0,0,846.9115,a8w8_blockscale_1x128x128_256x128x128x128_16x16_32x32_2x2_8x32x1_8x32x1_1x32x1x8_8_1x1_intrawave_v3,1510.34,613.55,0.0
256,25440,8192,3072,ck,0,0,852.0372,a8w8_blockscale_1x128x128_256x128x128x128_16x16_32x32_2x2_8x32x1_8x32x1_1x32x1x8_8_1x1_intrawave_v3,1502.79,610.45,0.0
256,25462,8192,3072,ck,0,0,848.6257,a8w8_blockscale_1x128x128_256x128x128x128_16x16_32x32_2x2_8x32x1_8x32x1_1x32x1x8_8_1x1_intrawave_v3,1510.14,613.41,0.0
256,25485,8192,3072,ck,0,0,857.4294,a8w8_blockscale_1x128x128_256x128x128x128_16x16_32x32_2x2_8x32x1_8x32x1_1x32x1x8_8_1x1_intrawave_v3,1495.99,607.63,0.0
256,25507,8192,3072,ck,0,0,851.5533,a8w8_blockscale_1x128x128_256x128x128x128_16x16_32x32_2x2_8x32x1_8x32x1_1x32x1x8_8_1x1_intrawave_v3,1507.61,612.33,0.0
256,25530,8192,3072,ck,0,0,827.1172,a8w8_blockscale_1x128x128_256x128x128x128_16x16_32x32_2x2_8x32x1_8x32x1_1x32x1x8_8_1x1_intrawave_v3,1553.55,630.96,0.0
256,25553,8192,3072,ck,0,0,853.9414,a8w8_blockscale_1x128x128_256x128x128x128_16x16_32x32_2x2_8x32x1_8x32x1_1x32x1x8_8_1x1_intrawave_v3,1506.1,611.66,0.0
256,25576,8192,3072,ck,0,0,850.3232,a8w8_blockscale_1x128x128_256x128x128x128_16x16_32x32_2x2_8x32x1_8x32x1_1x32x1x8_8_1x1_intrawave_v3,1513.87,614.79,0.0
256,25601,8192,3072,ck,0,0,833.6049,a8w8_blockscale_1x128x128_256x128x128x128_16x16_32x32_2x2_8x32x1_8x32x1_1x32x1x8_8_1x1_intrawave_v3,1545.74,627.71,0.0
256,25626,8192,3072,ck,0,0,838.3645,a8w8_blockscale_1x128x128_256x128x128x128_16x16_32x32_2x2_8x32x1_8x32x1_1x32x1x8_8_1x1_intrawave_v3,1538.47,624.72,0.0
256,25653,8192,3072,ck,0,0,857.905,a8w8_blockscale_1x128x128_256x128x128x128_16x16_32x32_2x2_8x32x1_8x32x1_1x32x1x8_8_1x1_intrawave_v3,1505.01,611.11,0.0
256,25675,8192,3072,ck,0,0,843.3428,a8w8_blockscale_1x128x128_256x128x128x128_16x16_32x32_2x2_8x32x1_8x32x1_1x32x1x8_8_1x1_intrawave_v3,1532.31,622.17,0.0
256,25890,8192,3072,ck,0,0,863.1792,a8w8_blockscale_1x128x128_256x128x128x128_16x16_32x32_2x2_8x32x1_8x32x1_1x32x1x8_8_1x1_intrawave_v3,1509.64,612.71,0.0
256,25897,8192,3072,ck,0,0,864.2524,a8w8_blockscale_1x128x128_256x128x128x128_16x16_32x32_2x2_8x32x1_8x32x1_1x32x1x8_8_1x1_intrawave_v3,1508.17,612.11,0.0
256,26029,8192,3072,ck,0,0,875.5202,a8w8_blockscale_1x128x128_256x128x128x128_16x16_32x32_2x2_8x32x1_8x32x1_1x32x1x8_8_1x1_intrawave_v3,1496.35,607.17,0.0
256,26762,8192,3072,ck,0,0,869.0656,a8w8_blockscale_1x128x128_256x128x128x128_16x16_32x32_2x2_8x32x1_8x32x1_1x32x1x8_8_1x1_intrawave_v3,1549.91,628.09,0.0
256,27005,8192,3072,ck,0,0,880.2618,a8w8_blockscale_1x128x128_256x128x128x128_16x16_32x32_2x2_8x32x1_8x32x1_1x32x1x8_8_1x1_intrawave_v3,1544.09,625.47,0.0
256,27026,8192,3072,ck,0,0,878.044,a8w8_blockscale_1x128x128_256x128x128x128_16x16_32x32_2x2_8x32x1_8x32x1_1x32x1x8_8_1x1_intrawave_v3,1549.2,627.51,0.0
256,27239,8192,3072,ck,0,0,910.369,a8w8_blockscale_1x128x128_256x128x128x128_16x16_32x32_2x2_8x32x1_8x32x1_1x32x1x8_8_1x1_intrawave_v3,1505.96,609.78,0.0
256,27284,8192,3072,ck,0,0,912.2663,a8w8_blockscale_1x128x128_256x128x128x128_16x16_32x32_2x2_8x32x1_8x32x1_1x32x1x8_8_1x1_intrawave_v3,1505.32,609.47,0.0
256,27309,8192,3072,ck,0,0,884.9565,a8w8_blockscale_1x128x128_256x128x128x128_16x16_32x32_2x2_8x32x1_8x32x1_1x32x1x8_8_1x1_intrawave_v3,1553.19,628.83,0.0
256,27400,8192,3072,ck,0,0,920.333,a8w8_blockscale_1x128x128_256x128x128x128_16x16_32x32_2x2_8x32x1_8x32x1_1x32x1x8_8_1x1_intrawave_v3,1498.47,606.59,0.0
256,27671,8192,3072,ck,0,0,931.7889,a8w8_blockscale_1x128x128_256x128x128x128_16x16_32x32_2x2_8x32x1_8x32x1_1x32x1x8_8_1x1_intrawave_v3,1494.68,604.79,0.0
256,27691,8192,3072,ck,0,0,909.9641,a8w8_blockscale_1x128x128_256x128x128x128_16x16_32x32_2x2_8x32x1_8x32x1_1x32x1x8_8_1x1_intrawave_v3,1531.64,619.72,0.0
256,28007,8192,3072,ck,0,0,907.6324,a8w8_blockscale_1x128x128_256x128x128x128_16x16_32x32_2x2_8x32x1_8x32x1_1x32x1x8_8_1x1_intrawave_v3,1553.09,628.08,0.0
256,28398,8192,3072,ck,0,0,919.2207,a8w8_blockscale_1x128x128_256x128x128x128_16x16_32x32_2x2_8x32x1_8x32x1_1x32x1x8_8_1x1_intrawave_v3,1554.92,628.44,0.0
256,28997,8192,3072,ck,0,0,972.4713,a8w8_blockscale_1x128x128_256x128x128x128_16x16_32x32_2x2_8x32x1_8x32x1_1x32x1x8_8_1x1_intrawave_v3,1500.78,606.01,0.0
256,29003,8192,3072,ck,0,0,976.8032,a8w8_blockscale_1x128x128_256x128x128x128_16x16_32x32_2x2_8x32x1_8x32x1_1x32x1x8_8_1x1_intrawave_v3,1494.43,603.45,0.0
256,29662,8192,3072,ck,0,0,994.8103,a8w8_blockscale_1x128x128_256x128x128x128_16x16_32x32_2x2_8x32x1_8x32x1_1x32x1x8_8_1x1_intrawave_v3,1500.73,605.41,0.0
256,30002,8192,3072,ck,0,0,1011.8222,a8w8_blockscale_1x128x128_256x128x128x128_16x16_32x32_2x2_8x32x1_8x32x1_1x32x1x8_8_1x1_intrawave_v3,1492.41,601.77,0.0
256,30003,8192,3072,ck,0,0,970.5134,a8w8_blockscale_1x128x128_256x128x128x128_16x16_32x32_2x2_8x32x1_8x32x1_1x32x1x8_8_1x1_intrawave_v3,1555.98,627.4,0.0
256,30013,8192,3072,ck,0,0,1009.7801,a8w8_blockscale_1x128x128_256x128x128x128_16x16_32x32_2x2_8x32x1_8x32x1_1x32x1x8_8_1x1_intrawave_v3,1495.97,603.2,0.0
256,30026,8192,3072,ck,0,0,1011.4349,a8w8_blockscale_1x128x128_256x128x128x128_16x16_32x32_2x2_8x32x1_8x32x1_1x32x1x8_8_1x1_intrawave_v3,1494.17,602.46,0.0
256,30327,8192,3072,ck,0,0,1018.2201,a8w8_blockscale_1x128x128_256x128x128x128_16x16_32x32_2x2_8x32x1_8x32x1_1x32x1x8_8_1x1_intrawave_v3,1499.09,604.2,0.0
256,30482,8192,3072,ck,0,0,1027.3346,a8w8_blockscale_1x128x128_256x128x128x128_16x16_32x32_2x2_8x32x1_8x32x1_1x32x1x8_8_1x1_intrawave_v3,1493.39,601.77,0.0
256,30507,8192,3072,ck,0,0,988.1757,a8w8_blockscale_1x128x128_256x128x128x128_16x16_32x32_2x2_8x32x1_8x32x1_1x32x1x8_8_1x1_intrawave_v3,1553.84,626.11,0.0
256,30535,8192,3072,ck,0,0,1028.9989,a8w8_blockscale_1x128x128_256x128x128x128_16x16_32x32_2x2_8x32x1_8x32x1_1x32x1x8_8_1x1_intrawave_v3,1493.57,601.8,0.0
256,30755,8192,3072,ck,0,0,1038.7753,a8w8_blockscale_1x128x128_256x128x128x128_16x16_32x32_2x2_8x32x1_8x32x1_1x32x1x8_8_1x1_intrawave_v3,1490.17,600.26,0.0
256,30801,8192,3072,ck,0,0,999.0559,a8w8_blockscale_1x128x128_256x128x128x128_16x16_32x32_2x2_8x32x1_8x32x1_1x32x1x8_8_1x1_intrawave_v3,1551.73,625.02,0.0
256,30828,8192,3072,ck,0,0,1043.7956,a8w8_blockscale_1x128x128_256x128x128x128_16x16_32x32_2x2_8x32x1_8x32x1_1x32x1x8_8_1x1_intrawave_v3,1486.52,598.73,0.0
256,30833,8192,3072,ck,0,0,999.7602,a8w8_blockscale_1x128x128_256x128x128x128_16x16_32x32_2x2_8x32x1_8x32x1_1x32x1x8_8_1x1_intrawave_v3,1552.25,625.2,0.0
256,30835,8192,3072,ck,0,0,1000.3908,a8w8_blockscale_1x128x128_256x128x128x128_16x16_32x32_2x2_8x32x1_8x32x1_1x32x1x8_8_1x1_intrawave_v3,1551.37,624.85,0.0
256,30837,8192,3072,ck,0,0,999.0057,a8w8_blockscale_1x128x128_256x128x128x128_16x16_32x32_2x2_8x32x1_8x32x1_1x32x1x8_8_1x1_intrawave_v3,1553.62,625.75,0.0
256,30840,8192,3072,ck,0,0,998.8367,a8w8_blockscale_1x128x128_256x128x128x128_16x16_32x32_2x2_8x32x1_8x32x1_1x32x1x8_8_1x1_intrawave_v3,1554.04,625.92,0.0
256,30842,8192,3072,ck,0,0,1032.6898,a8w8_blockscale_1x128x128_256x128x128x128_16x16_32x32_2x2_8x32x1_8x32x1_1x32x1x8_8_1x1_intrawave_v3,1503.19,605.44,0.0
256,30848,8192,3072,ck,0,0,986.8714,a8w8_blockscale_1x128x128_256x128x128x128_16x16_32x32_2x2_8x32x1_8x32x1_1x32x1x8_8_1x1_intrawave_v3,1573.29,633.66,0.0
256,30868,8192,3072,ck,0,0,1038.4147,a8w8_blockscale_1x128x128_256x128x128x128_16x16_32x32_2x2_8x32x1_8x32x1_1x32x1x8_8_1x1_intrawave_v3,1496.16,602.59,0.0
256,31008,8192,3072,ck,0,0,1044.4205,a8w8_blockscale_1x128x128_256x128x128x128_16x16_32x32_2x2_8x32x1_8x32x1_1x32x1x8_8_1x1_intrawave_v3,1494.31,601.73,0.0
256,31016,8192,3072,ck,0,0,1003.4127,a8w8_blockscale_1x128x128_256x128x128x128_16x16_32x32_2x2_8x32x1_8x32x1_1x32x1x8_8_1x1_intrawave_v3,1555.78,626.48,0.0
256,31051,8192,3072,ck,0,0,1041.77,a8w8_blockscale_1x128x128_256x128x128x128_16x16_32x32_2x2_8x32x1_8x32x1_1x32x1x8_8_1x1_intrawave_v3,1500.19,604.06,0.0
256,31053,8192,3072,ck,0,0,1035.156,a8w8_blockscale_1x128x128_256x128x128x128_16x16_32x32_2x2_8x32x1_8x32x1_1x32x1x8_8_1x1_intrawave_v3,1509.87,607.96,0.0
256,31055,8192,3072,ck,0,0,1047.3057,a8w8_blockscale_1x128x128_256x128x128x128_16x16_32x32_2x2_8x32x1_8x32x1_1x32x1x8_8_1x1_intrawave_v3,1492.45,600.94,0.0
256,31057,8192,3072,ck,0,0,1003.0144,a8w8_blockscale_1x128x128_256x128x128x128_16x16_32x32_2x2_8x32x1_8x32x1_1x32x1x8_8_1x1_intrawave_v3,1558.45,627.52,0.0
256,31059,8192,3072,ck,0,0,1003.8084,a8w8_blockscale_1x128x128_256x128x128x128_16x16_32x32_2x2_8x32x1_8x32x1_1x32x1x8_8_1x1_intrawave_v3,1557.32,627.06,0.0
256,31061,8192,3072,ck,0,0,1037.8819,a8w8_blockscale_1x128x128_256x128x128x128_16x16_32x32_2x2_8x32x1_8x32x1_1x32x1x8_8_1x1_intrawave_v3,1506.29,606.51,0.0
256,31063,8192,3072,ck,0,0,1002.1868,a8w8_blockscale_1x128x128_256x128x128x128_16x16_32x32_2x2_8x32x1_8x32x1_1x32x1x8_8_1x1_intrawave_v3,1560.04,628.15,0.0
256,31065,8192,3072,ck,0,0,1042.9655,a8w8_blockscale_1x128x128_256x128x128x128_16x16_32x32_2x2_8x32x1_8x32x1_1x32x1x8_8_1x1_intrawave_v3,1499.14,603.63,0.0
256,31184,8192,3072,ck,0,0,1037.3706,a8w8_blockscale_1x128x128_256x128x128x128_16x16_32x32_2x2_8x32x1_8x32x1_1x32x1x8_8_1x1_intrawave_v3,1513.0,609.12,0.0
256,31216,8192,3072,ck,0,0,1038.6894,a8w8_blockscale_1x128x128_256x128x128x128_16x16_32x32_2x2_8x32x1_8x32x1_1x32x1x8_8_1x1_intrawave_v3,1512.63,608.94,0.0
256,31218,8192,3072,ck,0,0,1040.6065,a8w8_blockscale_1x128x128_256x128x128x128_16x16_32x32_2x2_8x32x1_8x32x1_1x32x1x8_8_1x1_intrawave_v3,1509.94,607.86,0.0
256,31220,8192,3072,ck,0,0,1039.5004,a8w8_blockscale_1x128x128_256x128x128x128_16x16_32x32_2x2_8x32x1_8x32x1_1x32x1x8_8_1x1_intrawave_v3,1511.64,608.54,0.0
256,31223,8192,3072,ck,0,0,1008.8352,a8w8_blockscale_1x128x128_256x128x128x128_16x16_32x32_2x2_8x32x1_8x32x1_1x32x1x8_8_1x1_intrawave_v3,1557.74,627.1,0.0
256,31225,8192,3072,ck,0,0,1044.9589,a8w8_blockscale_1x128x128_256x128x128x128_16x16_32x32_2x2_8x32x1_8x32x1_1x32x1x8_8_1x1_intrawave_v3,1503.99,605.46,0.0
256,31393,8192,3072,ck,0,0,1051.2284,a8w8_blockscale_1x128x128_256x128x128x128_16x16_32x32_2x2_8x32x1_8x32x1_1x32x1x8_8_1x1_intrawave_v3,1503.06,604.96,0.0
256,31992,8192,3072,ck,0,0,1067.9256,a8w8_blockscale_1x128x128_256x128x128x128_16x16_32x32_2x2_8x32x1_8x32x1_1x32x1x8_8_1x1_intrawave_v3,1507.79,606.41,0.0
256,32004,8192,3072,ck,0,0,1066.6512,a8w8_blockscale_1x128x128_256x128x128x128_16x16_32x32_2x2_8x32x1_8x32x1_1x32x1x8_8_1x1_intrawave_v3,1510.16,607.35,0.0
256,32011,8192,3072,ck,0,0,1070.0103,a8w8_blockscale_1x128x128_256x128x128x128_16x16_32x32_2x2_8x32x1_8x32x1_1x32x1x8_8_1x1_intrawave_v3,1505.75,605.58,0.0
256,32035,8192,3072,ck,0,0,1075.6221,a8w8_blockscale_1x128x128_256x128x128x128_16x16_32x32_2x2_8x32x1_8x32x1_1x32x1x8_8_1x1_intrawave_v3,1499.02,602.85,0.0
256,32036,8192,3072,ck,0,0,1070.3486,a8w8_blockscale_1x128x128_256x128x128x128_16x16_32x32_2x2_8x32x1_8x32x1_1x32x1x8_8_1x1_intrawave_v3,1506.45,605.84,0.0
256,32039,8192,3072,ck,0,0,1070.0263,a8w8_blockscale_1x128x128_256x128x128x128_16x16_32x32_2x2_8x32x1_8x32x1_1x32x1x8_8_1x1_intrawave_v3,1507.04,606.08,0.0
256,32264,8192,3072,ck,0,0,1046.5301,a8w8_blockscale_1x128x128_256x128x128x128_16x16_32x32_2x2_8x32x1_8x32x1_1x32x1x8_8_1x1_intrawave_v3,1551.7,623.87,0.0
256,32285,8192,3072,ck,0,0,1083.5537,a8w8_blockscale_1x128x128_256x128x128x128_16x16_32x32_2x2_8x32x1_8x32x1_1x32x1x8_8_1x1_intrawave_v3,1499.66,602.93,0.0
