aiter/configs/model_configs/kimik2_fp8fp4_tuned_fmoe.csv
cu_num,token,model_dim,inter_dim,expert,topk,act_type,dtype,q_dtype_a,q_dtype_w,q_type,use_g1u1,doweight_stage1,block_m,ksplit,us1,kernelName1,err1,us2,kernelName2,err2,us,run_1stage,tflops,bw,_tag
256,1024,7168,256,384,8,ActivationType.Silu,torch.bfloat16,torch.float8_e4m3fn,torch.float4_e2m1fn_x2,QuantType.per_1x32,1,0,32,0,123.0893,flydsl_moe1_afp8_wfp4_bf16_t32x128x256_w2_gui_fp8,0.0%,105.2591,flydsl_moe2_afp8_wfp4_bf16_t32x256x256_atomic_bnt2,0.0%,228.3484,0,394.99,9353.91,
256,2048,7168,256,384,8,ActivationType.Silu,torch.bfloat16,torch.float8_e4m3fn,torch.float4_e2m1fn_x2,QuantType.per_1x32,1,0,64,0,133.8259,flydsl_moe1_afp8_wfp4_bf16_t64x256x256_w3_gui_fp8,0.0%,156.8906,flydsl_moe2_afp8_wfp4_bf16_t64x256x256_reduce_bnt2_persist,0.0%,290.7165,0,620.5,7422.93,
256,4096,7168,256,384,8,ActivationType.Silu,torch.bfloat16,torch.float8_e4m3fn,torch.float4_e2m1fn_x2,QuantType.per_1x32,1,0,128,0,168.2474,flydsl_moe1_afp8_wfp4_bf16_t128x256x256_gui_fp8,0.0%,292.1704,flydsl_moe2_afp8_wfp4_bf16_t128x256x256_reduce_persist,0.0%,460.4178,0,783.59,4782.63,
256,8192,7168,256,384,8,ActivationType.Silu,torch.bfloat16,torch.float8_e4m3fn,torch.float4_e2m1fn_x2,QuantType.per_1x32,1,0,128,0,302.4767,flydsl_moe1_afp8_wfp4_bf16_t128x256x256_bnt0_gui_fp8,0.0%,514.8898,flydsl_moe2_afp8_wfp4_bf16_t64x256x256_reduce_persist_sbm128,0.0%,817.3665,0,882.78,2801.79,
256,16384,7168,256,384,8,ActivationType.Silu,torch.bfloat16,torch.float8_e4m3fn,torch.float4_e2m1fn_x2,QuantType.per_1x32,1,0,128,0,481.7208,flydsl_moe1_afp8_wfp4_bf16_t128x256x256_bnt0_gui_fp8,0.0%,1006.5923,flydsl_moe2_afp8_wfp4_bf16_t128x256x256_reduce_bnt2,0.0%,1488.3131,0,969.63,1657.08,
256,32768,7168,256,384,8,ActivationType.Silu,torch.bfloat16,torch.float8_e4m3fn,torch.float4_e2m1fn_x2,QuantType.per_1x32,1,0,64,0,876.5187,flydsl_moe1_afp8_wfp4_bf16_t64x256x256_bnt0_gui_xcd4_fp8,0.0%,1845.739,flydsl_moe2_afp8_wfp4_bf16_t64x256x256_reduce_xcd4,0.0%,2722.2577,0,1060.23,1035.38,
256,1024,7168,512,384,8,ActivationType.Silu,torch.bfloat16,torch.float8_e4m3fn,torch.float4_e2m1fn_x2,QuantType.per_1x32,1,0,32,0,236.2331,flydsl_moe1_afp8_wfp4_bf16_t32x128x256_w3_gui_fp8,0.0%,151.5334,flydsl_moe2_afp8_wfp4_bf16_t32x256x256_atomic_bnt2,0.0%,387.7665,0,465.2,10959.89,
256,2048,7168,512,384,8,ActivationType.Silu,torch.bfloat16,torch.float8_e4m3fn,torch.float4_e2m1fn_x2,QuantType.per_1x32,1,0,64,0,250.8169,flydsl_moe1_afp8_wfp4_bf16_t64x256x256_gui_fp8,0.0%,208.9952,flydsl_moe2_afp8_wfp4_bf16_t64x256x256_atomic_bnt2_persist,0.0%,459.8121,0,784.62,9290.53,
256,4096,7168,512,384,8,ActivationType.Silu,torch.bfloat16,torch.float8_e4m3fn,torch.float4_e2m1fn_x2,QuantType.per_1x32,1,0,128,0,321.0343,flydsl_moe1_afp8_wfp4_bf16_t128x256x256_gui_fp8,0.0%,385.9324,flydsl_moe2_afp8_wfp4_bf16_t64x256x256_reduce_persist_sbm128,0.0%,706.9667,0,1020.63,6104.87,
256,8192,7168,512,384,8,ActivationType.Silu,torch.bfloat16,torch.float8_e4m3fn,torch.float4_e2m1fn_x2,QuantType.per_1x32,1,0,64,0,563.8091000000001,flydsl_moe1_afp8_wfp4_bf16_t64x256x256_w3_bnt0_gui,0.0%,594.2764,flydsl_moe2_afp8_wfp4_bf16_t64x256x256_reduce,0.0%,1158.0855,0,1246.12,3802.84,
256,16384,7168,512,384,8,ActivationType.Silu,torch.bfloat16,torch.float8_e4m3fn,torch.float4_e2m1fn_x2,QuantType.per_1x32,1,0,128,0,870.6742,flydsl_moe1_afp8_wfp4_bf16_t128x256x256_w2_bnt0_gui_fp8,0.0%,1154.1545,flydsl_moe2_afp8_wfp4_bf16_t64x256x256_reduce_persist_sbm128,0.0%,2024.8287,0,1425.41,2262.01,
256,32768,7168,512,384,8,ActivationType.Silu,torch.bfloat16,torch.float8_e4m3fn,torch.float4_e2m1fn_x2,QuantType.per_1x32,1,0,128,0,1581.5182,flydsl_moe1_afp8_wfp4_bf16_t128x256x256_w2_bnt0_gui_fp8,0.0%,2214.8461,flydsl_moe2_afp8_wfp4_bf16_t64x256x256_reduce_persist_sbm128,0.0%,3796.3643,0,1520.52,1299.27,
256,1024,7168,512,385,9,ActivationType.Silu,torch.bfloat16,torch.float8_e4m3fn,torch.float4_e2m1fn_x2,QuantType.per_1x32,1,0,32,0,241.4155,flydsl_moe1_afp8_wfp4_bf16_t32x128x256_w3_gui_fp8,0.0%,157.2231,flydsl_moe2_afp8_wfp4_bf16_t32x256x256_atomic_bnt2_persist,0.0%,398.6386,0,509.08,10688.6,
256,2048,7168,512,385,9,ActivationType.Silu,torch.bfloat16,torch.float8_e4m3fn,torch.float4_e2m1fn_x2,QuantType.per_1x32,1,0,64,0,269.3204,flydsl_moe1_afp8_wfp4_bf16_t64x256x256_w2_gui_fp8,0.0%,230.4879,flydsl_moe2_afp8_wfp4_bf16_t64x256x256_reduce_bnt2,0.0%,499.8083,0,812.06,8569.1,
256,4096,7168,512,385,9,ActivationType.Silu,torch.bfloat16,torch.float8_e4m3fn,torch.float4_e2m1fn_x2,QuantType.per_1x32,1,0,128,0,342.8696,flydsl_moe1_afp8_wfp4_bf16_t128x256x256_w3_gui_fp8,0.0%,410.5732,flydsl_moe2_afp8_wfp4_bf16_t64x256x256_reduce_persist_sbm128,0.0%,753.4428,0,1077.39,5742.9,
256,8192,7168,512,385,9,ActivationType.Silu,torch.bfloat16,torch.float8_e4m3fn,torch.float4_e2m1fn_x2,QuantType.per_1x32,1,0,64,0,589.8479,flydsl_moe1_afp8_wfp4_bf16_t64x256x256_w2_bnt0_gui,0.0%,653.2881,flydsl_moe2_afp8_wfp4_bf16_t64x256x256_reduce_persist,0.0%,1243.136,0,1305.97,3551.53,
256,16384,7168,512,385,9,ActivationType.Silu,torch.bfloat16,torch.float8_e4m3fn,torch.float4_e2m1fn_x2,QuantType.per_1x32,1,0,128,0,936.1311,flydsl_moe1_afp8_wfp4_bf16_t128x256x256_bnt0_gui_fp8,0.0%,1291.6956,flydsl_moe2_afp8_wfp4_bf16_t64x256x256_reduce_persist_sbm128,0.0%,2227.8267,0,1457.47,2060.84,
256,32768,7168,512,385,9,ActivationType.Silu,torch.bfloat16,torch.float8_e4m3fn,torch.float4_e2m1fn_x2,QuantType.per_1x32,1,0,128,0,1700.6587,flydsl_moe1_afp8_wfp4_bf16_t128x256x256_bnt0_gui_fp8,0.0%,2482.132,flydsl_moe2_afp8_wfp4_bf16_t64x256x256_reduce_persist_sbm128,0.0%,4182.7907,0,1552.55,1181.87,
256,1024,7168,256,385,9,ActivationType.Silu,torch.bfloat16,torch.float8_e4m3fn,torch.float4_e2m1fn_x2,QuantType.per_1x32,1,0,32,0,126.9676,flydsl_moe1_afp8_wfp4_bf16_t32x128x256_w3_gui_fp8,0.0%,117.2557,flydsl_moe2_afp8_wfp4_bf16_t32x256x256_atomic_bnt2,0.0%,244.2233,0,415.47,8768.43,
256,2048,7168,256,385,9,ActivationType.Silu,torch.bfloat16,torch.float8_e4m3fn,torch.float4_e2m1fn_x2,QuantType.per_1x32,1,0,64,0,146.7519,flydsl_moe1_afp8_wfp4_bf16_t64x128x256_w3_gui_fp8,0.0%,166.7794,flydsl_moe2_afp8_wfp4_bf16_t64x256x256_reduce,0.0%,313.5313,0,647.26,6900.35,
256,4096,7168,256,385,9,ActivationType.Silu,torch.bfloat16,torch.float8_e4m3fn,torch.float4_e2m1fn_x2,QuantType.per_1x32,1,0,128,0,194.7301,flydsl_moe1_afp8_wfp4_bf16_t128x256x256_gui_fp8,0.0%,311.4187,flydsl_moe2_afp8_wfp4_bf16_t128x256x256_reduce,0.0%,506.1488,0,801.89,4361.39,
256,8192,7168,256,385,9,ActivationType.Silu,torch.bfloat16,torch.float8_e4m3fn,torch.float4_e2m1fn_x2,QuantType.per_1x32,1,0,128,0,333.7686,flydsl_moe1_afp8_wfp4_bf16_t128x256x256_w2_bnt0_gui_fp8,0.0%,545.4913,flydsl_moe2_afp8_wfp4_bf16_t64x256x256_reduce_persist_sbm128,0.0%,879.2599,0,923.22,2610.83,
256,16384,7168,256,385,9,ActivationType.Silu,torch.bfloat16,torch.float8_e4m3fn,torch.float4_e2m1fn_x2,QuantType.per_1x32,1,0,128,0,523.6283,flydsl_moe1_afp8_wfp4_bf16_t128x256x256_w2_bnt0_gui_fp8,0.0%,1069.9622,flydsl_moe2_afp8_wfp4_bf16_t64x256x256_reduce_bnt2_persist_sbm128,0.0%,1593.5905,0,1018.77,1551.06,
256,32768,7168,256,385,9,ActivationType.Silu,torch.bfloat16,torch.float8_e4m3fn,torch.float4_e2m1fn_x2,QuantType.per_1x32,1,0,128,0,907.3006,flydsl_moe1_afp8_wfp4_bf16_t128x256x256_w3_bnt0_gui_fp8,0.0%,2060.5967,flydsl_moe2_afp8_wfp4_bf16_t64x256x256_reduce_xcd4_sbm128,0.0%,2967.8973,0,1094.04,951.54,
256,512,7168,256,384,8,ActivationType.Silu,torch.bfloat16,torch.float8_e4m3fn,torch.float4_e2m1fn_x2,QuantType.per_1x32,1,0,32,0,119.1612,flydsl_moe1_afp8_wfp4_bf16_t32x128x256_w3_gui_fp8,0.0%,79.3586,flydsl_moe2_afp8_wfp4_bf16_t32x256x256_atomic_bnt2_persist,0.0%,198.5198,0,227.17,10703.92,
256,131072,7168,256,384,8,ActivationType.Silu,torch.bfloat16,torch.float8_e4m3fn,torch.float4_e2m1fn_x2,QuantType.per_1x32,1,0,128,0,3052.6405,flydsl_moe1_afp8_wfp4_bf16_t128x256x256_w2_bnt0_gui_xcd4_fp8,0.0%,6954.0181,flydsl_moe2_afp8_wfp4_bf16_t128x256x256_reduce_xcd4,0.0%,10006.6586,0,1153.72,492.92,
256,512,7168,512,384,8,ActivationType.Silu,torch.bfloat16,torch.float8_e4m3fn,torch.float4_e2m1fn_x2,QuantType.per_1x32,1,0,32,0,230.262,flydsl_moe1_afp8_wfp4_bf16_t32x128x256_w3_gui_fp8,0.0%,136.2811,flydsl_moe2_afp8_wfp4_bf16_t32x256x256_atomic_bnt2_persist,0.0%,366.5431,0,246.07,11564.45,
256,131072,7168,512,384,8,ActivationType.Silu,torch.bfloat16,torch.float8_e4m3fn,torch.float4_e2m1fn_x2,QuantType.per_1x32,1,0,128,0,6018.3408,flydsl_moe1_afp8_wfp4_bf16_t128x256x256_w3_bnt0_gui_xcd4_fp8,0.0%,8085.1723,flydsl_moe2_afp8_wfp4_bf16_t64x256x256_reduce_xcd4_sbm128,0.0%,14103.5131,0,1637.16,499.62,
256,512,7168,512,385,9,ActivationType.Silu,torch.bfloat16,torch.float8_e4m3fn,torch.float4_e2m1fn_x2,QuantType.per_1x32,1,0,32,0,236.9899,flydsl_moe1_afp8_wfp4_bf16_t32x128x256_w3_gui_fp8,0.0%,138.7571,flydsl_moe2_afp8_wfp4_bf16_t32x256x256_atomic_bnt2_persist,0.0%,375.747,0,270.05,11310.48,
256,131072,7168,512,385,9,ActivationType.Silu,torch.bfloat16,torch.float8_e4m3fn,torch.float4_e2m1fn_x2,QuantType.per_1x32,1,0,128,0,6384.608,flydsl_moe1_afp8_wfp4_bf16_t128x256x256_w3_bnt0_gui_fp8,0.0%,9168.6363,flydsl_moe2_afp8_wfp4_bf16_t64x256x256_reduce_xcd4_sbm128,0.0%,15553.2443,0,1670.13,453.76,
256,512,7168,256,385,9,ActivationType.Silu,torch.bfloat16,torch.float8_e4m3fn,torch.float4_e2m1fn_x2,QuantType.per_1x32,1,0,32,0,125.4126,flydsl_moe1_afp8_wfp4_bf16_t32x128x256_w3_gui_fp8,0.0%,80.3704,flydsl_moe2_afp8_wfp4_bf16_t32x256x256_atomic_bnt2,0.0%,205.783,0,246.54,10352.87,
256,131072,7168,256,385,9,ActivationType.Silu,torch.bfloat16,torch.float8_e4m3fn,torch.float4_e2m1fn_x2,QuantType.per_1x32,1,0,128,0,3303.1397,flydsl_moe1_afp8_wfp4_bf16_t128x256x256_w3_bnt0_gui_fp8,0.0%,7645.4133,flydsl_moe2_afp8_wfp4_bf16_t128x256x256_reduce_xcd4_persist,0.0%,10948.553,0,1186.27,451.02,
256,1,7168,256,384,8,ActivationType.Silu,torch.bfloat16,torch.float8_e4m3fn,torch.float4_e2m1fn_x2,QuantType.per_1x32,1,0,32,0,18.1556,flydsl_moe1_afp8_wfp4_bf16_t32x128x256_w4_gui_fp8,0.0%,8.2377,flydsl_moe2_afp8_wfp4_bf16_t32x128x256_atomic_bnt2,0.0%,26.3933,0,3.34,80094.22,
256,2,7168,256,384,8,ActivationType.Silu,torch.bfloat16,torch.float8_e4m3fn,torch.float4_e2m1fn_x2,QuantType.per_1x32,1,0,32,0,18.6916,flydsl_moe1_afp8_wfp4_bf16_t32x128x256_w2_gui_fp8,0.0%,9.9646,flydsl_moe2_afp8_wfp4_bf16_t32x128x256_atomic_bnt2,0.0%,28.6562,0,6.15,73770.15,
256,4,7168,256,384,8,ActivationType.Silu,torch.bfloat16,torch.float8_e4m3fn,torch.float4_e2m1fn_x2,QuantType.per_1x32,1,0,32,0,20.7748,flydsl_moe1_afp8_wfp4_bf16_t32x128x256_w4_gui_fp8,0.0%,12.612,flydsl_moe2_afp8_wfp4_bf16_t32x128x256_atomic_persist,0.0%,33.3868,0,10.55,63318.89,
256,8,7168,256,384,8,ActivationType.Silu,torch.bfloat16,torch.float8_e4m3fn,torch.float4_e2m1fn_x2,QuantType.per_1x32,1,0,32,0,23.8348,flydsl_moe1_afp8_wfp4_bf16_t32x128x256_w3_gui_fp8,0.0%,18.0554,flydsl_moe2_afp8_wfp4_bf16_t32x128x256_atomic_persist,0.0%,41.8902,0,16.82,50467.68,
256,16,7168,256,384,8,ActivationType.Silu,torch.bfloat16,torch.float8_e4m3fn,torch.float4_e2m1fn_x2,QuantType.per_1x32,1,0,32,0,41.463,flydsl_moe1_afp8_wfp4_bf16_t32x64x256_w4_gui_fp8,0.0%,27.6645,flydsl_moe2_afp8_wfp4_bf16_t32x256x256_atomic_persist,0.0%,69.1275,0,20.39,30585.13,
256,32,7168,256,384,8,ActivationType.Silu,torch.bfloat16,torch.float8_e4m3fn,torch.float4_e2m1fn_x2,QuantType.per_1x32,1,0,32,0,78.9174,flydsl_moe1_afp8_wfp4_bf16_t32x128x256_w2_gui_fp8,0.0%,46.3514,flydsl_moe2_afp8_wfp4_bf16_t32x256x256_atomic_bnt2_persist,0.0%,125.2688,0,22.5,16880.64,
256,64,7168,256,384,8,ActivationType.Silu,torch.bfloat16,torch.float8_e4m3fn,torch.float4_e2m1fn_x2,QuantType.per_1x32,1,0,32,0,115.1392,flydsl_moe1_afp8_wfp4_bf16_t32x128x256_w3_gui_fp8,0.0%,65.6663,flydsl_moe2_afp8_wfp4_bf16_t32x256x256_atomic_bnt2,0.0%,180.8055,0,31.18,11699.34,
256,128,7168,256,384,8,ActivationType.Silu,torch.bfloat16,torch.float8_e4m3fn,torch.float4_e2m1fn_x2,QuantType.per_1x32,1,0,32,0,115.1344,flydsl_moe1_afp8_wfp4_bf16_t32x128x256_w4_gui_fp8,0.0%,67.9951,flydsl_moe2_afp8_wfp4_bf16_t32x256x256_atomic_bnt2,0.0%,183.1295,0,61.56,11558.39,
256,256,7168,256,384,8,ActivationType.Silu,torch.bfloat16,torch.float8_e4m3fn,torch.float4_e2m1fn_x2,QuantType.per_1x32,1,0,32,0,116.363,flydsl_moe1_afp8_wfp4_bf16_t32x128x256_w3_gui_fp8,0.0%,71.1699,flydsl_moe2_afp8_wfp4_bf16_t32x256x256_atomic_bnt2,0.0%,187.5329,0,120.24,11301.67,
256,1,7168,512,384,8,ActivationType.Silu,torch.bfloat16,torch.float8_e4m3fn,torch.float4_e2m1fn_x2,QuantType.per_1x32,1,0,32,0,18.4827,flydsl_moe1_afp8_wfp4_bf16_t32x128x256_w4_gui_fp8,0.0%,8.0465,flydsl_moe2_afp8_wfp4_bf16_t32x128x256_atomic_persist,0.0%,26.5292,0,6.64,159367.03,
256,2,7168,512,384,8,ActivationType.Silu,torch.bfloat16,torch.float8_e4m3fn,torch.float4_e2m1fn_x2,QuantType.per_1x32,1,0,32,0,20.2638,flydsl_moe1_afp8_wfp4_bf16_t32x128x256_w4_gui_xcd4_fp8,0.0%,12.7659,flydsl_moe2_afp8_wfp4_bf16_t32x128x256_atomic_persist,0.0%,33.0297,0,10.67,128003.02,
256,4,7168,512,384,8,ActivationType.Silu,torch.bfloat16,torch.float8_e4m3fn,torch.float4_e2m1fn_x2,QuantType.per_1x32,1,0,32,0,22.532,flydsl_moe1_afp8_wfp4_bf16_t32x128x256_w2_gui_fp8,0.0%,18.0501,flydsl_moe2_afp8_wfp4_bf16_t32x256x256_atomic_bnt2_xcd4_persist,0.0%,40.5821,0,17.36,104182.5,
256,8,7168,512,384,8,ActivationType.Silu,torch.bfloat16,torch.float8_e4m3fn,torch.float4_e2m1fn_x2,QuantType.per_1x32,1,0,32,0,41.1119,flydsl_moe1_afp8_wfp4_bf16_t32x64x256_w4_gui_fp8,0.0%,27.7547,flydsl_moe2_afp8_wfp4_bf16_t32x256x256_atomic_bnt2_xcd4_persist,0.0%,68.8666,0,20.46,61394.5,
256,16,7168,512,384,8,ActivationType.Silu,torch.bfloat16,torch.float8_e4m3fn,torch.float4_e2m1fn_x2,QuantType.per_1x32,1,0,32,0,79.2976,flydsl_moe1_afp8_wfp4_bf16_t32x128x256_w2_gui_xcd4_fp8,0.0%,44.895,flydsl_moe2_afp8_wfp4_bf16_t32x256x256_atomic_bnt2_xcd4,0.0%,124.1926,0,22.7,34045.53,
256,32,7168,512,384,8,ActivationType.Silu,torch.bfloat16,torch.float8_e4m3fn,torch.float4_e2m1fn_x2,QuantType.per_1x32,1,0,32,0,151.2377,flydsl_moe1_afp8_wfp4_bf16_t32x128x256_w3_gui_xcd4_fp8,0.0%,80.7113,flydsl_moe2_afp8_wfp4_bf16_t32x256x256_atomic_bnt2_xcd4,0.0%,231.949,0,24.3,18230.5,
256,64,7168,512,384,8,ActivationType.Silu,torch.bfloat16,torch.float8_e4m3fn,torch.float4_e2m1fn_x2,QuantType.per_1x32,1,0,32,0,231.2629,flydsl_moe1_afp8_wfp4_bf16_t32x128x256_w3_gui,0.0%,118.817,flydsl_moe2_afp8_wfp4_bf16_t32x256x256_atomic_bnt2_xcd4_persist,0.0%,350.0799,0,32.2,12080.77,
256,128,7168,512,384,8,ActivationType.Silu,torch.bfloat16,torch.float8_e4m3fn,torch.float4_e2m1fn_x2,QuantType.per_1x32,1,0,32,0,224.1075,flydsl_moe1_afp8_wfp4_bf16_t32x128x256_w4_gui_fp8,0.0%,122.7286,flydsl_moe2_afp8_wfp4_bf16_t32x256x256_atomic_bnt2_xcd4,0.0%,346.8361,0,65.01,12197.72,
256,256,7168,512,384,8,ActivationType.Silu,torch.bfloat16,torch.float8_e4m3fn,torch.float4_e2m1fn_x2,QuantType.per_1x32,1,0,32,0,227.083,flydsl_moe1_afp8_wfp4_bf16_t32x128x256_w3_gui_fp8,0.0%,128.3562,flydsl_moe2_afp8_wfp4_bf16_t32x256x256_atomic_bnt2_persist,0.0%,355.4392,0,126.88,11910.23,
256,1,7168,1024,384,8,ActivationType.Silu,torch.bfloat16,torch.float8_e4m3fn,torch.float4_e2m1fn_x2,QuantType.per_1x32,1,0,32,0,16.1099,flydsl_moe1_afp8_wfp4_bf16_t32x128x256_w4_bnt0_gui_xcd4_fp8,0.0%,11.7819,flydsl_moe2_afp8_wfp4_bf16_t32x128x256_atomic_xcd4_persist,0.0%,27.8918,0,12.63,303162.16,
256,2,7168,1024,384,8,ActivationType.Silu,torch.bfloat16,torch.float8_e4m3fn,torch.float4_e2m1fn_x2,QuantType.per_1x32,1,0,32,0,22.4722,flydsl_moe1_afp8_wfp4_bf16_t32x128x256_w3_gui_fp8,0.0%,17.0116,flydsl_moe2_afp8_wfp4_bf16_t32x128x256_atomic_bnt2_persist,0.0%,39.4838,0,17.85,214157.7,
256,4,7168,1024,384,8,ActivationType.Silu,torch.bfloat16,torch.float8_e4m3fn,torch.float4_e2m1fn_x2,QuantType.per_1x32,1,0,32,0,39.4595,flydsl_moe1_afp8_wfp4_bf16_t32x64x256_w4_gui_fp8,0.0%,27.0304,flydsl_moe2_afp8_wfp4_bf16_t32x128x256_atomic_bnt2_persist,0.0%,66.4899,0,21.2,127174.25,
256,8,7168,1024,384,8,ActivationType.Silu,torch.bfloat16,torch.float8_e4m3fn,torch.float4_e2m1fn_x2,QuantType.per_1x32,1,0,32,0,79.371,flydsl_moe1_afp8_wfp4_bf16_t32x128x256_w2_gui_fp8,0.0%,44.6834,flydsl_moe2_afp8_wfp4_bf16_t32x128x256_atomic_bnt2_persist,0.0%,124.0544,0,22.72,68162.75,
256,16,7168,1024,384,8,ActivationType.Silu,torch.bfloat16,torch.float8_e4m3fn,torch.float4_e2m1fn_x2,QuantType.per_1x32,1,0,32,0,153.0991,flydsl_moe1_afp8_wfp4_bf16_t32x128x256_w3_gui_fp8,0.0%,80.9631,flydsl_moe2_afp8_wfp4_bf16_t32x128x256_atomic_bnt2_xcd4,0.0%,234.0622,0,24.08,36127.41,
256,32,7168,1024,384,8,ActivationType.Silu,torch.bfloat16,torch.float8_e4m3fn,torch.float4_e2m1fn_x2,QuantType.per_1x32,1,0,32,0,300.6815,flydsl_moe1_afp8_wfp4_bf16_t32x128x256_w3_gui_fp8,0.0%,152.3597,flydsl_moe2_afp8_wfp4_bf16_t32x128x256_atomic_bnt2_xcd4,0.0%,453.0412,0,24.89,18665.86,
256,64,7168,1024,384,8,ActivationType.Silu,torch.bfloat16,torch.float8_e4m3fn,torch.float4_e2m1fn_x2,QuantType.per_1x32,1,0,32,0,444.5648,flydsl_moe1_afp8_wfp4_bf16_t32x128x256_w2_gui_fp8,0.0%,224.7643,flydsl_moe2_afp8_wfp4_bf16_t16x128x256_atomic_bnt2_persist_sbm32,0.0%,669.3291,0,33.69,12635.18,
256,128,7168,1024,384,8,ActivationType.Silu,torch.bfloat16,torch.float8_e4m3fn,torch.float4_e2m1fn_x2,QuantType.per_1x32,1,0,32,0,446.2756,flydsl_moe1_afp8_wfp4_bf16_t32x128x256_w2_gui_fp8,0.0%,228.709,flydsl_moe2_afp8_wfp4_bf16_t16x128x256_atomic_bnt2_sbm32,0.0%,674.9846,0,66.81,12531.35,
256,256,7168,1024,384,8,ActivationType.Silu,torch.bfloat16,torch.float8_e4m3fn,torch.float4_e2m1fn_x2,QuantType.per_1x32,1,0,32,0,447.8744,flydsl_moe1_afp8_wfp4_bf16_t32x128x256_w4_gui_fp8,0.0%,233.7873,flydsl_moe2_afp8_wfp4_bf16_t32x128x256_atomic_bnt2_persist,0.0%,681.6617,0,132.32,12412.64,
256,512,7168,1024,384,8,ActivationType.Silu,torch.bfloat16,torch.float8_e4m3fn,torch.float4_e2m1fn_x2,QuantType.per_1x32,1,0,32,0,451.5384,flydsl_moe1_afp8_wfp4_bf16_t32x128x256_w3_gui_fp8,0.0%,241.7988,flydsl_moe2_afp8_wfp4_bf16_t32x128x256_atomic_bnt2,0.0%,693.3372,0,260.17,12211.56,
256,1024,7168,1024,384,8,ActivationType.Silu,torch.bfloat16,torch.float8_e4m3fn,torch.float4_e2m1fn_x2,QuantType.per_1x32,1,0,32,0,460.7844,flydsl_moe1_afp8_wfp4_bf16_t32x128x256_w4_gui_fp8,0.0%,262.941,flydsl_moe2_afp8_wfp4_bf16_t32x256x256_atomic_bnt2_persist,0.0%,723.7254,0,498.5,11714.02,
256,2048,7168,1024,384,8,ActivationType.Silu,torch.bfloat16,torch.float8_e4m3fn,torch.float4_e2m1fn_x2,QuantType.per_1x32,1,0,64,0,492.3107,flydsl_moe1_afp8_wfp4_bf16_t64x256x256_w4_gui_fp8,0.0%,319.6827,flydsl_moe2_afp8_wfp4_bf16_t64x256x256_atomic_bnt2_persist,0.0%,811.9934,0,888.62,10467.77,
256,4096,7168,1024,384,8,ActivationType.Silu,torch.bfloat16,torch.float8_e4m3fn,torch.float4_e2m1fn_x2,QuantType.per_1x32,1,0,128,0,644.0365,flydsl_moe1_afp8_wfp4_bf16_t128x256x256_w3_gui_fp8,0.0%,538.6539,flydsl_moe2_afp8_wfp4_bf16_t64x128x256_atomic_sbm128,0.0%,1182.6904,0,1220.19,7224.04,
256,1,7168,512,384,8,ActivationType.Silu,torch.bfloat16,torch.float8_e4m3fn,torch.float4_e2m1fn_x2,QuantType.per_1x32,1,0,32,0,33.0601,cktile_a8w4_bm32,0.0,8.0465,cktile_a8w4_bm32,0.0,41.1066,0,0.0,0.0,flydsl_fallback
256,2,7168,512,384,8,ActivationType.Silu,torch.bfloat16,torch.float8_e4m3fn,torch.float4_e2m1fn_x2,QuantType.per_1x32,1,0,32,0,34.1373,cktile_a8w4_bm32,0.0,14.2566,cktile_a8w4_bm32,0.0,48.3939,0,0.0,0.0,flydsl_fallback
256,4,7168,512,384,8,ActivationType.Silu,torch.bfloat16,torch.float8_e4m3fn,torch.float4_e2m1fn_x2,QuantType.per_1x32,1,0,32,0,37.077200000000005,cktile_a8w4_bm32,0.0,20.105,cktile_a8w4_bm32,0.0,57.1822,0,0.0,0.0,flydsl_fallback
256,8,7168,512,384,8,ActivationType.Silu,torch.bfloat16,torch.float8_e4m3fn,torch.float4_e2m1fn_x2,QuantType.per_1x32,1,0,32,0,50.3356,cktile_a8w4_bm32,0.0,32.1846,cktile_a8w4_bm32,0.0,82.5202,0,0.0,0.0,flydsl_fallback
256,16,7168,512,384,8,ActivationType.Silu,torch.bfloat16,torch.float8_e4m3fn,torch.float4_e2m1fn_x2,QuantType.per_1x32,1,0,32,0,88.74549999999999,cktile_a8w4_bm32,0.0,51.9082,cktile_a8w4_bm32,0.0,140.6537,0,0.0,0.0,flydsl_fallback
256,32,7168,512,384,8,ActivationType.Silu,torch.bfloat16,torch.float8_e4m3fn,torch.float4_e2m1fn_x2,QuantType.per_1x32,1,0,32,0,164.13449999999995,cktile_a8w4_bm32,0.0,96.7529,cktile_a8w4_bm32,0.0,260.8874,0,0.0,0.0,flydsl_fallback
256,64,7168,512,384,8,ActivationType.Silu,torch.bfloat16,torch.float8_e4m3fn,torch.float4_e2m1fn_x2,QuantType.per_1x32,1,0,32,0,234.3562,cktile_a8w4_bm32,0.0,141.1197,cktile_a8w4_bm32,0.0,375.4759,0,0.0,0.0,flydsl_fallback
256,128,7168,512,384,8,ActivationType.Silu,torch.bfloat16,torch.float8_e4m3fn,torch.float4_e2m1fn_x2,QuantType.per_1x32,1,0,32,0,235.3998,cktile_a8w4_bm32,0.0,147.3413,cktile_a8w4_bm32,0.0,382.7411,0,0.0,0.0,flydsl_fallback
256,256,7168,512,384,8,ActivationType.Silu,torch.bfloat16,torch.float8_e4m3fn,torch.float4_e2m1fn_x2,QuantType.per_1x32,1,0,32,0,242.3938,cktile_a8w4_bm32,0.0,154.4649,cktile_a8w4_bm32,0.0,396.8587,0,0.0,0.0,flydsl_fallback
256,1,7168,1024,384,8,ActivationType.Silu,torch.bfloat16,torch.float8_e4m3fn,torch.float4_e2m1fn_x2,QuantType.per_1x32,1,0,32,0,35.9909,cktile_a8w4_bm32,0.0,12.1969,cktile_a8w4_bm32,0.0,48.1878,0,0.0,0.0,flydsl_fallback
256,2,7168,1024,384,8,ActivationType.Silu,torch.bfloat16,torch.float8_e4m3fn,torch.float4_e2m1fn_x2,QuantType.per_1x32,1,0,32,0,37.71810000000001,cktile_a8w4_bm32,0.0,17.0116,cktile_a8w4_bm32,0.0,54.7297,0,0.0,0.0,flydsl_fallback
256,4,7168,1024,384,8,ActivationType.Silu,torch.bfloat16,torch.float8_e4m3fn,torch.float4_e2m1fn_x2,QuantType.per_1x32,1,0,32,0,50.1132,cktile_a8w4_bm32,0.0,28.3496,cktile_a8w4_bm32,0.0,78.4628,0,0.0,0.0,flydsl_fallback
256,8,7168,1024,384,8,ActivationType.Silu,torch.bfloat16,torch.float8_e4m3fn,torch.float4_e2m1fn_x2,QuantType.per_1x32,1,0,32,0,86.2204,cktile_a8w4_bm32,0.0,47.9751,cktile_a8w4_bm32,0.0,134.1955,0,0.0,0.0,flydsl_fallback
256,16,7168,1024,384,8,ActivationType.Silu,torch.bfloat16,torch.float8_e4m3fn,torch.float4_e2m1fn_x2,QuantType.per_1x32,1,0,32,0,160.6823,cktile_a8w4_bm32,0.0,82.5461,cktile_a8w4_bm32,0.0,243.2284,0,0.0,0.0,flydsl_fallback
256,32,7168,1024,384,8,ActivationType.Silu,torch.bfloat16,torch.float8_e4m3fn,torch.float4_e2m1fn_x2,QuantType.per_1x32,1,0,32,0,306.9409,cktile_a8w4_bm32,0.0,159.7773,cktile_a8w4_bm32,0.0,466.7182,0,0.0,0.0,flydsl_fallback
256,64,7168,1024,384,8,ActivationType.Silu,torch.bfloat16,torch.float8_e4m3fn,torch.float4_e2m1fn_x2,QuantType.per_1x32,1,0,32,0,452.9549,cktile_a8w4_bm32,0.0,233.813,cktile_a8w4_bm32,0.0,686.7679,0,0.0,0.0,flydsl_fallback
256,128,7168,1024,384,8,ActivationType.Silu,torch.bfloat16,torch.float8_e4m3fn,torch.float4_e2m1fn_x2,QuantType.per_1x32,1,0,32,0,455.9992,cktile_a8w4_bm32,0.0,236.2612,cktile_a8w4_bm32,0.0,692.2604,0,0.0,0.0,flydsl_fallback
256,256,7168,1024,384,8,ActivationType.Silu,torch.bfloat16,torch.float8_e4m3fn,torch.float4_e2m1fn_x2,QuantType.per_1x32,1,0,32,0,461.7324,cktile_a8w4_bm32,0.0,244.1371,cktile_a8w4_bm32,0.0,705.8695,0,0.0,0.0,flydsl_fallback
256,512,7168,1024,384,8,ActivationType.Silu,torch.bfloat16,torch.float8_e4m3fn,torch.float4_e2m1fn_x2,QuantType.per_1x32,1,0,32,0,509.0288,cktile_a8w4_bm32,0.0,267.0646,cktile_a8w4_bm32,0.0,776.0934,0,0.0,0.0,flydsl_fallback
256,1024,7168,1024,384,8,ActivationType.Silu,torch.bfloat16,torch.float8_e4m3fn,torch.float4_e2m1fn_x2,QuantType.per_1x32,1,0,32,0,517.9852,cktile_a8w4_bm32,0.0,294.1668,cktile_a8w4_bm32,0.0,812.152,0,0.0,0.0,flydsl_fallback
256,2048,7168,1024,384,8,ActivationType.Silu,torch.bfloat16,torch.float8_e4m3fn,torch.float4_e2m1fn_x2,QuantType.per_1x32,1,0,64,0,574.2261,cktile_a8w4_bm64,0.0,404.7197,cktile_a8w4_bm64,0.0,978.9458,0,0.0,0.0,flydsl_fallback
256,4096,7168,1024,384,8,ActivationType.Silu,torch.bfloat16,torch.float8_e4m3fn,torch.float4_e2m1fn_x2,QuantType.per_1x32,1,0,32,0,941.738,cktile_a8w4_bm32,0.0,536.1723,cktile_a8w4_bm32,0.0,1477.9103,0,0.0,0.0,flydsl_fallback
256,1,7168,256,384,8,ActivationType.Silu,torch.bfloat16,torch.float8_e4m3fn,torch.float4_e2m1fn_x2,QuantType.per_1x32,1,0,32,0,33.759,cktile_a8w4_bm32,0.0,8.2377,cktile_a8w4_bm32,0.0,41.9967,0,0.0,0.0,flydsl_fallback
256,2,7168,256,384,8,ActivationType.Silu,torch.bfloat16,torch.float8_e4m3fn,torch.float4_e2m1fn_x2,QuantType.per_1x32,1,0,32,0,33.6852,cktile_a8w4_bm32,0.0,9.9646,cktile_a8w4_bm32,0.0,43.6498,0,0.0,0.0,flydsl_fallback
256,4,7168,256,384,8,ActivationType.Silu,torch.bfloat16,torch.float8_e4m3fn,torch.float4_e2m1fn_x2,QuantType.per_1x32,1,0,32,0,35.5276,cktile_a8w4_bm32,0.0,16.2678,cktile_a8w4_bm32,0.0,51.7954,0,0.0,0.0,flydsl_fallback
256,8,7168,256,384,8,ActivationType.Silu,torch.bfloat16,torch.float8_e4m3fn,torch.float4_e2m1fn_x2,QuantType.per_1x32,1,0,32,0,42.2808,cktile_a8w4_bm32,0.0,24.3481,cktile_a8w4_bm32,0.0,66.6289,0,0.0,0.0,flydsl_fallback
256,16,7168,256,384,8,ActivationType.Silu,torch.bfloat16,torch.float8_e4m3fn,torch.float4_e2m1fn_x2,QuantType.per_1x32,1,0,32,0,53.3301,cktile_a8w4_bm32,0.0,38.18,cktile_a8w4_bm32,0.0,91.5101,0,0.0,0.0,flydsl_fallback
256,32,7168,256,384,8,ActivationType.Silu,torch.bfloat16,torch.float8_e4m3fn,torch.float4_e2m1fn_x2,QuantType.per_1x32,1,0,32,0,90.6705,cktile_a8w4_bm32,0.0,67.6923,cktile_a8w4_bm32,0.0,158.3628,0,0.0,0.0,flydsl_fallback
256,64,7168,256,384,8,ActivationType.Silu,torch.bfloat16,torch.float8_e4m3fn,torch.float4_e2m1fn_x2,QuantType.per_1x32,1,0,32,0,130.5523,cktile_a8w4_bm32,0.0,98.8788,cktile_a8w4_bm32,0.0,229.4311,0,0.0,0.0,flydsl_fallback
256,128,7168,256,384,8,ActivationType.Silu,torch.bfloat16,torch.float8_e4m3fn,torch.float4_e2m1fn_x2,QuantType.per_1x32,1,0,32,0,128.0803,cktile_a8w4_bm32,0.0,99.7698,cktile_a8w4_bm32,0.0,227.8501,0,0.0,0.0,flydsl_fallback
256,256,7168,256,384,8,ActivationType.Silu,torch.bfloat16,torch.float8_e4m3fn,torch.float4_e2m1fn_x2,QuantType.per_1x32,1,0,32,0,127.7004,cktile_a8w4_bm32,0.0,100.8044,cktile_a8w4_bm32,0.0,228.5048,0,0.0,0.0,flydsl_fallback
256,512,7168,256,384,8,ActivationType.Silu,torch.bfloat16,torch.float8_e4m3fn,torch.float4_e2m1fn_x2,QuantType.per_1x32,1,0,32,0,139.3696,cktile_a8w4_bm32,0.0,106.7266,cktile_a8w4_bm32,0.0,246.0962,0,0.0,0.0,flydsl_fallback
256,131072,7168,256,384,8,ActivationType.Silu,torch.bfloat16,torch.float8_e4m3fn,torch.float4_e2m1fn_x2,QuantType.per_1x32,1,0,64,0,3897.4695,cktile_a8w4_bm64,0.0,11790.5161,cktile_a8w4_bm64,0.0,15687.9856,0,0.0,0.0,flydsl_fallback
256,512,7168,512,384,8,ActivationType.Silu,torch.bfloat16,torch.float8_e4m3fn,torch.float4_e2m1fn_x2,QuantType.per_1x32,1,0,32,0,265.1341,cktile_a8w4_bm32,0.0,159.6032,cktile_a8w4_bm32,0.0,424.7373,0,0.0,0.0,flydsl_fallback
256,131072,7168,512,384,8,ActivationType.Silu,torch.bfloat16,torch.float8_e4m3fn,torch.float4_e2m1fn_x2,QuantType.per_1x32,1,0,64,0,7644.1875,cktile_a8w4_bm64,0.0,12120.2159,cktile_a8w4_bm64,0.0,19764.4034,0,0.0,0.0,flydsl_fallback
256,512,7168,512,385,9,ActivationType.Silu,torch.bfloat16,torch.float8_e4m3fn,torch.float4_e2m1fn_x2,QuantType.per_1x32,1,0,32,0,283.445,cktile_a8w4_bm32,0.0,160.9444,cktile_a8w4_bm32,0.0,444.3894,0,0.0,0.0,flydsl_fallback
256,131072,7168,512,385,9,ActivationType.Silu,torch.bfloat16,torch.float8_e4m3fn,torch.float4_e2m1fn_x2,QuantType.per_1x32,1,0,64,0,8892.2449,cktile_a8w4_bm64,0.0,14030.8646,cktile_a8w4_bm64,0.0,22923.1095,0,0.0,0.0,flydsl_fallback
256,512,7168,256,385,9,ActivationType.Silu,torch.bfloat16,torch.float8_e4m3fn,torch.float4_e2m1fn_x2,QuantType.per_1x32,1,0,32,0,156.2523,cktile_a8w4_bm32,0.0,108.3953,cktile_a8w4_bm32,0.0,264.6476,0,0.0,0.0,flydsl_fallback
256,131072,7168,256,385,9,ActivationType.Silu,torch.bfloat16,torch.float8_e4m3fn,torch.float4_e2m1fn_x2,QuantType.per_1x32,1,0,64,0,4453.171,cktile_a8w4_bm64,0.0,13495.6183,cktile_a8w4_bm64,0.0,17948.7893,0,0.0,0.0,flydsl_fallback
256,1024,7168,256,384,8,ActivationType.Silu,torch.bfloat16,torch.float8_e4m3fn,torch.float4_e2m1fn_x2,QuantType.per_1x32,1,0,32,0,142.6997,cktile_a8w4_bm32,0.0,124.1896,cktile_a8w4_bm32,0.0,266.8893,0,0.0,0.0,flydsl_fallback
256,2048,7168,256,384,8,ActivationType.Silu,torch.bfloat16,torch.float8_e4m3fn,torch.float4_e2m1fn_x2,QuantType.per_1x32,1,0,32,0,173.4389,cktile_a8w4_bm32,0.0,201.3501,cktile_a8w4_bm32,0.0,374.789,0,0.0,0.0,flydsl_fallback
256,4096,7168,256,384,8,ActivationType.Silu,torch.bfloat16,torch.float8_e4m3fn,torch.float4_e2m1fn_x2,QuantType.per_1x32,1,0,32,0,224.7223,cktile_a8w4_bm32,0.0,380.1632,cktile_a8w4_bm32,0.0,604.8855,0,0.0,0.0,flydsl_fallback
256,8192,7168,256,384,8,ActivationType.Silu,torch.bfloat16,torch.float8_e4m3fn,torch.float4_e2m1fn_x2,QuantType.per_1x32,1,0,64,0,321.4143,cktile_a8w4_bm64,0.0,731.9281,cktile_a8w4_bm64,0.0,1053.3424,0,0.0,0.0,flydsl_fallback
256,16384,7168,256,384,8,ActivationType.Silu,torch.bfloat16,torch.float8_e4m3fn,torch.float4_e2m1fn_x2,QuantType.per_1x32,1,0,64,0,572.6357,cktile_a8w4_bm64,0.0,1445.6359,cktile_a8w4_bm64,0.0,2018.2716,0,0.0,0.0,flydsl_fallback
256,32768,7168,256,384,8,ActivationType.Silu,torch.bfloat16,torch.float8_e4m3fn,torch.float4_e2m1fn_x2,QuantType.per_1x32,1,0,64,0,1018.5422,cktile_a8w4_bm64,0.0,2870.1453,cktile_a8w4_bm64,0.0,3888.6875,0,0.0,0.0,flydsl_fallback
256,1024,7168,512,384,8,ActivationType.Silu,torch.bfloat16,torch.float8_e4m3fn,torch.float4_e2m1fn_x2,QuantType.per_1x32,1,0,32,0,273.0062,cktile_a8w4_bm32,0.0,171.5034,cktile_a8w4_bm32,0.0,444.5096,0,0.0,0.0,flydsl_fallback
256,2048,7168,512,384,8,ActivationType.Silu,torch.bfloat16,torch.float8_e4m3fn,torch.float4_e2m1fn_x2,QuantType.per_1x32,1,0,32,0,318.9878,cktile_a8w4_bm32,0.0,253.7825,cktile_a8w4_bm32,0.0,572.7703,0,0.0,0.0,flydsl_fallback
256,4096,7168,512,384,8,ActivationType.Silu,torch.bfloat16,torch.float8_e4m3fn,torch.float4_e2m1fn_x2,QuantType.per_1x32,1,0,32,0,431.1773,cktile_a8w4_bm32,0.0,393.7221,cktile_a8w4_bm32,0.0,824.8994,0,0.0,0.0,flydsl_fallback
256,8192,7168,512,384,8,ActivationType.Silu,torch.bfloat16,torch.float8_e4m3fn,torch.float4_e2m1fn_x2,QuantType.per_1x32,1,0,32,0,688.4932,cktile_a8w4_bm32,0.0,765.334,cktile_a8w4_bm32,0.0,1453.8272,0,0.0,0.0,flydsl_fallback
256,16384,7168,512,384,8,ActivationType.Silu,torch.bfloat16,torch.float8_e4m3fn,torch.float4_e2m1fn_x2,QuantType.per_1x32,1,0,32,0,1189.1030999999998,cktile_a8w4_bm32,0.0,1463.1439,cktile_a8w4_bm32,0.0,2652.247,0,0.0,0.0,flydsl_fallback
256,32768,7168,512,384,8,ActivationType.Silu,torch.bfloat16,torch.float8_e4m3fn,torch.float4_e2m1fn_x2,QuantType.per_1x32,1,0,64,0,1988.53,cktile_a8w4_bm64,0.0,3026.5083,cktile_a8w4_bm64,0.0,5015.0383,0,0.0,0.0,flydsl_fallback
256,1024,7168,512,385,9,ActivationType.Silu,torch.bfloat16,torch.float8_e4m3fn,torch.float4_e2m1fn_x2,QuantType.per_1x32,1,0,32,0,286.284,cktile_a8w4_bm32,0.0,175.2685,cktile_a8w4_bm32,0.0,461.5525,0,0.0,0.0,flydsl_fallback
256,2048,7168,512,385,9,ActivationType.Silu,torch.bfloat16,torch.float8_e4m3fn,torch.float4_e2m1fn_x2,QuantType.per_1x32,1,0,32,0,349.7174,cktile_a8w4_bm32,0.0,262.9544,cktile_a8w4_bm32,0.0,612.6718,0,0.0,0.0,flydsl_fallback
256,4096,7168,512,385,9,ActivationType.Silu,torch.bfloat16,torch.float8_e4m3fn,torch.float4_e2m1fn_x2,QuantType.per_1x32,1,0,32,0,441.6842,cktile_a8w4_bm32,0.0,423.2442,cktile_a8w4_bm32,0.0,864.9284,0,0.0,0.0,flydsl_fallback
256,8192,7168,512,385,9,ActivationType.Silu,torch.bfloat16,torch.float8_e4m3fn,torch.float4_e2m1fn_x2,QuantType.per_1x32,1,0,32,0,723.1021,cktile_a8w4_bm32,0.0,832.2823,cktile_a8w4_bm32,0.0,1555.3844,0,0.0,0.0,flydsl_fallback
256,16384,7168,512,385,9,ActivationType.Silu,torch.bfloat16,torch.float8_e4m3fn,torch.float4_e2m1fn_x2,QuantType.per_1x32,1,0,64,0,1155.2034,cktile_a8w4_bm64,0.0,1754.2978,cktile_a8w4_bm64,0.0,2909.5012,0,0.0,0.0,flydsl_fallback
256,32768,7168,512,385,9,ActivationType.Silu,torch.bfloat16,torch.float8_e4m3fn,torch.float4_e2m1fn_x2,QuantType.per_1x32,1,0,64,0,2183.6604,cktile_a8w4_bm64,0.0,3390.8062,cktile_a8w4_bm64,0.0,5574.4666,0,0.0,0.0,flydsl_fallback
256,1024,7168,256,385,9,ActivationType.Silu,torch.bfloat16,torch.float8_e4m3fn,torch.float4_e2m1fn_x2,QuantType.per_1x32,1,0,32,0,161.18650000000002,cktile_a8w4_bm32,0.0,129.6653,cktile_a8w4_bm32,0.0,290.8518,0,0.0,0.0,flydsl_fallback
256,2048,7168,256,385,9,ActivationType.Silu,torch.bfloat16,torch.float8_e4m3fn,torch.float4_e2m1fn_x2,QuantType.per_1x32,1,0,32,0,193.0266,cktile_a8w4_bm32,0.0,215.5235,cktile_a8w4_bm32,0.0,408.5501,0,0.0,0.0,flydsl_fallback
256,4096,7168,256,385,9,ActivationType.Silu,torch.bfloat16,torch.float8_e4m3fn,torch.float4_e2m1fn_x2,QuantType.per_1x32,1,0,32,0,237.3953,cktile_a8w4_bm32,0.0,413.8183,cktile_a8w4_bm32,0.0,651.2136,0,0.0,0.0,flydsl_fallback
256,8192,7168,256,385,9,ActivationType.Silu,torch.bfloat16,torch.float8_e4m3fn,torch.float4_e2m1fn_x2,QuantType.per_1x32,1,0,64,0,344.532,cktile_a8w4_bm64,0.0,814.1671,cktile_a8w4_bm64,0.0,1158.6991,0,0.0,0.0,flydsl_fallback
256,16384,7168,256,385,9,ActivationType.Silu,torch.bfloat16,torch.float8_e4m3fn,torch.float4_e2m1fn_x2,QuantType.per_1x32,1,0,64,0,607.9427000000001,cktile_a8w4_bm64,0.0,1611.4606,cktile_a8w4_bm64,0.0,2219.4033,0,0.0,0.0,flydsl_fallback
256,32768,7168,256,385,9,ActivationType.Silu,torch.bfloat16,torch.float8_e4m3fn,torch.float4_e2m1fn_x2,QuantType.per_1x32,1,0,64,0,1150.4311,cktile_a8w4_bm64,0.0,3221.5736,cktile_a8w4_bm64,0.0,4372.0047,0,0.0,0.0,flydsl_fallback
